uid,title,abstract,year,venue,authors,doi,arxiv_id,url,source,query,query_role,family,advisor_seed,citation_count,matched_terms,retrieved_at,relevance_score,hostile_score
arxiv:2011.01552v2,Efficient Sampling of Transition Constraints for Motion Planning under Sliding Contacts,"Contact-based motion planning for manipulation, object exploration or balancing often requires finding sequences of fixed and sliding contacts and planning the transition from one contact in the environment to another. However, most existing algorithms concentrate on the control and learning aspect of sliding contacts, but do not embed the problem into a principled framework to provide guarantees on completeness or optimality. To address this problem, we propose a method to extend constraint-based planning using contact transitions for sliding contacts. Such transitions are elementary operations required for whole contact sequences. To model sliding contacts, we define a sliding contact constraint that permits the robot to slide on the surface of a mesh-based object. To exploit transitions between sliding contacts, we develop a contact transition sampler, which uses three constraint mode",2020,arXiv,Marie-Therese Khoury; Andreas Orthey; Marc Toussaint,,2011.01552v2,http://arxiv.org/abs/2011.01552v2,arxiv,sampling based motion planning,anti_myopia,anti_thesis,,,motion planning; long horizon; sampling based motion planning,2026-06-12T15:07:36Z,16.100,20.100
doi:10.23919/acc55779.2023.10156245,Soft-Minimum Barrier Functions for Safety-Critical Control Subject to Actuation Constraints,"This paper presents a new control approach for guaranteed safety (remaining in a safe set) subject to actuator constraints (the control is in a convex polytope). The control signals are computed using real-time optimization, including linear and quadratic programs subject to affine constraints, which are shown to be feasible. The control method relies on a new soft-minimum barrier function that is constructed using a finite-time-horizon prediction of the system trajectories under a known backup control. The main result shows that: (i) the control is continuous and satisfies the actuator constraints, and (ii) a subset of the safe set is forward invariant under the control. We also demonstrate this control on numerical simulations of an inverted pendulum and a double-integrator ground robot.",2023,arXiv,Pedram Rabiee; Jesse B. Hoagg,10.23919/acc55779.2023.10156245,2304.00693v2,http://arxiv.org/abs/2304.00693v2,arxiv,embodied world model planning control,concept,world_models,,,,2026-06-12T14:45:03Z,16.100,16.100
doi:10.1109/lra.2022.3141192,Differential Dynamic Programming With Nonlinear Safety Constraints Under System Uncertainties,,2022,IEEE Robotics and Automation Letters,Gokhan Alcan; Ville Kyrki,10.1109/lra.2022.3141192,,https://doi.org/10.1109/lra.2022.3141192,crossref,EBM transformer robotics multi robot system,concept,architecture_x_embodiment,,8,EBM transformer robotics; multi robot system; safety constraint,2026-06-12T15:07:36Z,16.099,16.099
doi:10.3390/foods12142709,"Pesticide Use and Degradation Strategies: Food Safety, Challenges and Perspectives","While recognizing the gaps in pesticide regulations that impact consumer safety, public health concerns associated with pesticide contamination of foods are pointed out. The strategies and research directions proposed to prevent and/or reduce pesticide adverse effects on human health and the environment are discussed. Special attention is paid to organophosphate pesticides, as widely applied insecticides in agriculture, veterinary practices, and urban areas. Biotic and abiotic strategies for organophosphate pesticide degradation are discussed from a food safety perspective, indicating associated challenges and potential for further improvements. As food systems are endangered globally by unprecedented challenges, there is an urgent need to globally harmonize pesticide regulations and improve methodologies in the area of food safety to protect human health.",2023,Foods,Andreja Leskovac; Sandra Petrović,10.3390/foods12142709,,https://doi.org/10.3390/foods12142709,openalex,energy based transformer robot policy,concept,ebm_transformer,,145,energy based transformer robot policy,2026-06-12T18:05:07Z,16.092,16.092
doi:10.1115/dscc2019-9237,On Receding Horizon Chance Constraint Motion Planning for Uncertain Multi-Agent Systems,Abstract We propose and study a motion planning algorithm for multi-agent autonomous systems to navigate through uncertain and dynamic environments. We use a receding horizon chance constraint framework that allows for tuning the trade-off between the risk of collision and the infeasibility of paths. We consider sampling-based incremental planning algorithms and extend them to the case of multiple agents and dynamic and uncertain environments. The receding horizon control framework is used to incorporate sensor measurements at a fixed interval of time to reduce uncertainty about agents’ state and environment. Our presentation focuses on rapidly-exploring random trees (RRTs) and the assumption of Gaussian noise in the uncertainty model. Our algorithm is illustrated using several examples.,2019,"Volume 3, Rapid Fire Interactive Presentations: Advances in Control Systems; Advances in Robotics and Mechatronics; Automotive and Transportation Systems; Motion Planning and Trajectory Tracking; Soft Mechatronic Actuators and Sensors; Unmanned Ground and Aerial Vehicles",Yash Bagla; Vaibhav Srivastava,10.1115/dscc2019-9237,,https://doi.org/10.1115/dscc2019-9237,crossref,task and motion planning robotics,anti_myopia,classic,,,motion planning; task and motion planning,2026-06-12T15:07:36Z,16.050,21.050
doi:10.1145/3648004,Cooperative Driving of Connected Autonomous vehicle using Responsibility Sensitive Safety Rules: A Control Barrier Functions Approach,"Connected Autonomous Vehicles (CAVs) are expected to enable reliable, efficient, and intelligent transportation systems. Most motion-planning algorithms for multi-agent systems implicitly assume that all vehicles/agents will execute the expected plan with a small error and evaluate their safety constraints based on this fact. This assumption, however, is hard to keep for CAVs since they may have to change their plan (e.g., to yield to another vehicle) or are forced to stop (e.g., a CAV may break down). While it is desired that a CAV never gets involved in an accident, it may be hit by other vehicles and, sometimes, preventing the accident is impossible (e.g., getting hit from behind while waiting at a red light). Responsibility-Sensitive Safety (RSS) is a set of safety rules that defines the objective of CAVs to blame, instead of safety. Thus, instead of developing a CAV algorithm that w",2024,ACM Transactions on Cyber-Physical Systems,Mohammad Khayatian; Mohammadreza Mehrabian; I-Ching Tseng; Chung-Wei Lin; Calin Belta; Aviral Shrivastava,10.1145/3648004,,https://doi.org/10.1145/3648004,crossref,control barrier functions robot learning,anti_myopia,control,,,safety constraint; control barrier function; motion planning,2026-06-12T15:07:36Z,16.050,20.050
doi:10.1109/tiv.2023.3239903,Safety-Balanced Driving-Style Aware Trajectory Planning in Intersection Scenarios With Uncertain Environment,"This paper proposes a two-stage trajectory planning method for self-driving vehicles (SDVs) in intersection scenarios with uncertain social circumstances while considering other traffic participants, which are human-driving vehicles (HDVs) with different driving styles. The mixture-of-experts approach is first utilized to learn from human-driving trajectory data to construct a multimodal motion planner, which uses a Transformer to model the interactions between vehicles by explicitly considering their driving styles to facilitate the integrated network to achieve scene-consistent multimodal trajectory prediction and candidate trajectory generation. Second, based on the generated trajectories for the SDV and the predicted trajectories for the other HDVs, each candidate planning trajectory is evaluated via a safety-balanced value function. After that, the trajectory with the highest value ",2023,IEEE Transactions on Intelligent Vehicles,Xiao Wang; Ke Tang; Xingyuan Dai; Jintao Xu; Jinhao Xi; Rui Ai; Yuxiao Wang; Weihao Gu; Changyin Sun,10.1109/tiv.2023.3239903,,https://doi.org/10.1109/tiv.2023.3239903,openalex,energy based transformer robot policy,concept,ebm_transformer,,63,energy based transformer robot policy; robustness,2026-06-12T18:05:07Z,16.029,17.029
doi:10.1109/icsess.2018.8663748,MRDDPG Algorithms for Path Planning of Free-Floating Space Robot,"In the path planning for manipulation of a free-floating space robot, the existing methods have difficulties in many constraints, poor adaptability, and other difficulties. For this reason, a path planning algorithm for free-floating space robots based on deep reinforcement learning is proposed. Firstly, considering the main constraints during path planning, three constraints, including safety performance, coupling disturbance and path length, are selected as multi-constraint criteria. And multi-constraint model for path planning is built. Then, the Multi-constrained Reward Function for processing the above constraints is designed, and the MRDDPG algorithm for solving the path planning model is proposed. Finally, the performance of the method is analyzed by simulation experiments. The result shows that the method can effectively complete the intelligent path planning task of free-floatin",2018,,Xiaodong Hu; Xuexiang Huang; Tianjian Hu; Shi Zhong; Jianjiang Hui,10.1109/icsess.2018.8663748,,https://doi.org/10.1109/icsess.2018.8663748,openalex,robotics,concept,openalex_bulk_robotics,,14,,2026-06-12T18:57:17Z,16.004,16.004
doi:10.1177/027836499901800103,Scaling the Dynamic Approach to Path Planning and Control: Competition among Behavioral Constraints,"The dynamic-systems approach to robotpathplanningdefinesa dynamics ofrbotbehavior in which task constraints contribute independently to a nonlinear vector field that governs robot actions. We address problems that arise in scaling this approach to handle complex behavioral requirements. We propose a dynamics that operates in the space of task constraints, determining the relative contribution of each constraint to the behavioral dynamics. Competition among task constraints is able to deal with problems that arise when combining constraint contributions, making it possible to specify tasks that are mome complex than simple navigation. To demonstrate the utility of this approach, we design a system of two agents to perform a cooperative navigation task We show how competition among constraints enables agents to make decisions regarding which behavior to execute in a given situation, result",1999,The International Journal of Robotics Research,Edward W. Large; Henrik I. Christensen; Ruzena Bajcsy,10.1177/027836499901800103,,https://doi.org/10.1177/027836499901800103,crossref,robotics,concept,crossref_bulk_robotics,,29,,2026-06-12T19:29:26Z,16.001,17.001
arxiv:2403.13297v3,POLICEd RL: Learning Closed-Loop Robot Control Policies with Provable Satisfaction of Hard Constraints,"In this paper, we seek to learn a robot policy guaranteed to satisfy state constraints. To encourage constraint satisfaction, existing RL algorithms typically rely on Constrained Markov Decision Processes and discourage constraint violations through reward shaping. However, such soft constraints cannot offer verifiable safety guarantees. To address this gap, we propose POLICEd RL, a novel RL algorithm explicitly designed to enforce affine hard constraints in closed-loop with a black-box environment. Our key insight is to force the learned policy to be affine around the unsafe set and use this affine region as a repulsive buffer to prevent trajectories from violating the constraint. We prove that such policies exist and guarantee constraint satisfaction. Our proposed framework is applicable to both systems with continuous and discrete state and action spaces and is agnostic to the choice ",2024,arXiv,Jean-Baptiste Bouvier; Kartik Nagpal; Negar Mehr,,2403.13297v3,http://arxiv.org/abs/2403.13297v3,arxiv,energy based policy robotics,concept,ebm,,,,2026-06-12T14:45:03Z,16.000,16.000
doi:10.1002/cesm.12041/v2/decision1,"Decision letter for ""The use of a large language model to create plain language summaries of evidence reviews in healthcare: A feasibility study""",,2024,,,10.1002/cesm.12041/v2/decision1,,https://doi.org/10.1002/cesm.12041/v2/decision1,crossref,large language model limitation robot planning,anti_myopia,anti_thesis,,,limitation; large language model limitation robot planning,2026-06-12T15:07:36Z,16.000,20.000
doi:10.1002/cesm.12041/v2/response1,"Author response for ""The use of a large language model to create plain language summaries of evidence reviews in healthcare: A feasibility study""",,2024,,Colleen Ovelman; Shannon Kugley; Gerald Gartlehner; Meera Viswanathan,10.1002/cesm.12041/v2/response1,,https://doi.org/10.1002/cesm.12041/v2/response1,crossref,large language model limitation robot planning,anti_myopia,anti_thesis,,,limitation; large language model limitation robot planning,2026-06-12T15:07:36Z,16.000,20.000
doi:10.1016/j.clinph.2020.10.003,"Safety and recommendations for TMS use in healthy subjects and patient populations, with updates on training, ethical and regulatory issues: Expert Guidelines","This article is based on a consensus conference, promoted and supported by the International Federation of Clinical Neurophysiology (IFCN), which took place in Siena (Italy) in October 2018. The meeting intended to update the ten-year-old safety guidelines for the application of transcranial magnetic stimulation (TMS) in research and clinical settings (Rossi et al., 2009). Therefore, only emerging and new issues are covered in detail, leaving still valid the 2009 recommendations regarding the description of conventional or patterned TMS protocols, the screening of subjects/patients, the need of neurophysiological monitoring for new protocols, the utilization of reference thresholds of stimulation, the managing of seizures and the list of minor side effects. New issues discussed in detail from the meeting up to April 2020 are safety issues of recently developed stimulation devices and pul",2020,Clinical Neurophysiology,Símone Rossi; Andrea Antal; Sven Bestmann; Marom Bikson; Carmen C. Brewer; Jürgen Brockmöller; Linda L. Carpenter; M. Cincotta; Robert Chen; Jeff Daskalakis; Vincenzo Di Lazzaro; Michael Fox; Mark S. George; Donald L. Gilbert; Vasilios Κ. Kimiskidis; Giacomo Koch; Risto J. Ilmoniemi; Jean Pascal Lefaucheur; Letizia Leocani; Sarah H. Lisanby,10.1016/j.clinph.2020.10.003,,https://doi.org/10.1016/j.clinph.2020.10.003,openalex,energy based model robot learning,concept,ebm,,1481,,2026-06-12T18:05:07Z,16.000,16.000
doi:10.1609/icaps.v26i1.13791,Path Planning under Interface-Based Constraints for Assistive Robotics,"We present a heuristic-based search method for path planning in shared human-robot control scenarios in which the robot should adhere to specific motion constraints imposed by the human's control interface. This approach to path planning gives special consideration to kinematic and dynamic constraints introduced to reconcile discrepancies between the control space of the user and the control space of the robot. The resulting paths more closely mirror paths produced by users of the same interface; which is helpful, for example, when inferring human intent or for control sharing. Our first insight is to develop a hierarchical finite state machine describing the constrained state space, state transitions and associated costs. We then use this definition to embed the constraints of the interface into our heuristic planning algorithm, named C*, with simple modifications to the A*/D* family of",2016,Proceedings of the International Conference on Automated Planning and Scheduling,Alexander Broad; Brenna Argall,10.1609/icaps.v26i1.13791,,https://doi.org/10.1609/icaps.v26i1.13791,crossref,robotics,concept,crossref_bulk_robotics,,8,assistive robot,2026-06-12T19:29:26Z,15.949,15.949
doi:10.3390/s23084102,Dynamic Path Planning of AGV Based on Kinematical Constraint A* Algorithm and Following DWA Fusion Algorithms,"In the field of AGV, a path planning algorithm is always a heated area. However, traditional path planning algorithms have many disadvantages. To solve these problems, this paper proposes a fusion algorithm that combines the kinematical constraint A* algorithm and the following dynamic window approach algorithm. The kinematical constraint A* algorithm can plan the global path. Firstly, the node optimization can reduce the number of child nodes. Secondly, improving the heuristic function can increase efficiency of path planning. Thirdly, the secondary redundancy can reduce the number of redundant nodes. Finally, the B spline curve can make the global path conform to the dynamic characteristics of AGV. The following DWA algorithm can be dynamic path planning and allow the AGV to avoidance moving obstacle. The optimization heuristic function of the local path is closer to the global optimal",2023,Sensors,Xiong Yin; Ping Cai; Kangwen Zhao; Yu Zhang; Qian Zhou; Daojin Yao,10.3390/s23084102,,https://doi.org/10.3390/s23084102,openalex,energy based model robot learning,concept,ebm,,52,,2026-06-12T18:26:24Z,15.935,15.935
doi:10.1109/tpds.2016.2521373,GPU Robot Motion Planning Using Semi-Infinite Nonlinear Programming,"We propose a many-core GPU implementation of robotic motion planning formulated as a semi-infinite optimization program. Our approach computes the constraints and their gradients in parallel, and feeds the result to a nonlinear optimization solver running on the CPU. To ensure the continuous satisfaction of our constraints, we use polynomial approximations over time intervals. Because each constraint and its gradient can be evaluated independently for each time interval, we end up with a highly parallelizable problem that can take advantage of many-core architectures. Classic robotic computations (geometry, kinematics, and dynamics) can also benefit from parallel processors, and we carefully study their implementation in our context. This results in having a full constraint evaluator running on the GPU. We present several optimization examples with a humanoid robot. They reveal substanti",2016,IEEE Transactions on Parallel and Distributed Systems,Benjamin Chrétien; Adrien Escande; Abderrahmane Kheddar,10.1109/tpds.2016.2521373,,https://doi.org/10.1109/tpds.2016.2521373,openalex,robotics,concept,openalex_bulk_robotics,,28,humanoid robot; motion planning,2026-06-12T18:57:17Z,15.934,16.934
doi:10.3390/s21237898,Path Planning for Autonomous Mobile Robots: A Review,"Providing mobile robots with autonomous capabilities is advantageous. It allows one to dispense with the intervention of human operators, which may prove beneficial in economic and safety terms. Autonomy requires, in most cases, the use of path planners that enable the robot to deliberate about how to move from its location at one moment to another. Looking for the most appropriate path planning algorithm according to the requirements imposed by users can be challenging, given the overwhelming number of approaches that exist in the literature. Moreover, the past review works analyzed here cover only some of these approaches, missing important ones. For this reason, our paper aims to serve as a starting point for a clear and comprehensive overview of the research to date. It introduces a global classification of path planning algorithms, with a focus on those approaches used along with au",2021,Sensors,J. Ricardo Sánchez-Ibáñez; Carlos J. Pérez-del-Pulgar; Alfonso García-Cerezo,10.3390/s21237898,,https://doi.org/10.3390/s21237898,openalex,robotics,concept,openalex_bulk_robotics,,421,,2026-06-12T18:57:17Z,15.900,15.900
doi:10.3390/horticulturae11010088,Dynamic Task Planning for Multi-Arm Harvesting Robots Under Multiple Constraints Using Deep Reinforcement Learning,"Global fruit production costs are increasing amid intensified labor shortages, driving heightened interest in robotic harvesting technologies. Although multi-arm coordination in harvesting robots is considered a highly promising solution to this issue, it introduces technical challenges in achieving effective coordination. These challenges include mutual interference among multi-arm mechanical structures, task allocation across multiple arms, and dynamic operating conditions. This imposes higher demands on task coordination for multi-arm harvesting robots, requiring collision-free collaboration, optimization of task sequences, and dynamic re-planning. In this work, we propose a framework that models the task planning problem of multi-arm operation as a Markov game. First, considering multi-arm cooperative movement and picking sequence optimization, we employ a two-agent Markov game frame",2025,Horticulturae,Feng Xie; Zhengwei Guo; Tao Li; Qingchun Feng; Chunjiang Zhao,10.3390/horticulturae11010088,,https://doi.org/10.3390/horticulturae11010088,openalex,energy based model robot learning,concept,ebm,,41,robustness,2026-06-12T18:05:07Z,15.869,16.869
doi:10.3390/vehicles3030027,A Survey of Path Planning Algorithms for Mobile Robots,"Path planning algorithms are used by mobile robots, unmanned aerial vehicles, and autonomous cars in order to identify safe, efficient, collision-free, and least-cost travel paths from an origin to a destination. Choosing an appropriate path planning algorithm helps to ensure safe and effective point-to-point navigation, and the optimal algorithm depends on the robot geometry as well as the computing constraints, including static/holonomic and dynamic/non-holonomically-constrained systems, and requires a comprehensive understanding of contemporary solutions. The goal of this paper is to help novice practitioners gain an awareness of the classes of path planning algorithms used today and to understand their potential use cases—particularly within automated or unmanned systems. To that end, we provide broad, rather than deep, coverage of key and foundational algorithms, with popular algori",2021,Vehicles,Karthik Karur; Nitin Sharma; Chinmay Dharmatti; Joshua Siegel,10.3390/vehicles3030027,,https://doi.org/10.3390/vehicles3030027,openalex,robotics,concept,openalex_bulk_robotics,,377,,2026-06-12T18:57:17Z,15.867,15.867
arxiv:2508.11129v1,Geometry-Aware Predictive Safety Filters on Humanoids: From Poisson Safety Functions to CBF Constrained MPC,"Autonomous navigation through unstructured and dynamically-changing environments is a complex task that continues to present many challenges for modern roboticists. In particular, legged robots typically possess manipulable asymmetric geometries which must be considered during safety-critical trajectory planning. This work proposes a predictive safety filter: a nonlinear model predictive control (MPC) algorithm for online trajectory generation with geometry-aware safety constraints based on control barrier functions (CBFs). Critically, our method leverages Poisson safety functions to numerically synthesize CBF constraints directly from perception data. We extend the theoretical framework for Poisson safety functions to incorporate temporal changes in the domain by reformulating the static Dirichlet problem for Poisson's equation as a parameterized moving boundary value problem. Furthermo",2025,arXiv,Ryan M. Bena; Gilbert Bahati; Blake Werner; Ryan K. Cosner; Lizhi Yang; Aaron D. Ames,,2508.11129v1,http://arxiv.org/abs/2508.11129v1,arxiv,humanoid robot foundation model,concept,humanoid,,,robot foundation model; humanoid robot; safety constraint; control barrier function; model predictive control,2026-06-12T14:45:03Z,15.850,16.850
doi:10.48550/arxiv.1602.04450,Bayesian Optimization with Safety Constraints: Safe and Automatic\n Parameter Tuning in Robotics,"Robotic algorithms typically depend on various parameters, the choice of\nwhich significantly affects the robot's performance. While an initial guess for\nthe parameters may be obtained from dynamic models of the robot, parameters are\nusually tuned manually on the real system to achieve the best performance.\nOptimization algorithms, such as Bayesian optimization, have been used to\nautomate this process. However, these methods may evaluate unsafe parameters\nduring the optimization process that lead to safety-critical system failures.\nRecently, a safe Bayesian optimization algorithm, called SafeOpt, has been\ndeveloped, which guarantees that the performance of the system never falls\nbelow a critical value; that is, safety is defined based on the performance\nfunction. However, coupling performance and safety is often not desirable in\nrobotics. For example, high-gain controllers migh",2016,arXiv (Cornell University),Felix Berkenkamp; Andreas Krause; Angela P. Schoellig,10.48550/arxiv.1602.04450,,https://doi.org/10.48550/arxiv.1602.04450,openalex,robotics,concept,openalex_bulk_robotics,,26,safety constraint,2026-06-12T18:57:17Z,15.848,16.848
