uid,title,abstract,year,venue,authors,doi,arxiv_id,url,source,query,query_role,family,advisor_seed,citation_count,matched_terms,retrieved_at,relevance_score,hostile_score
doi:10.1115/1.861rob_ch11,Self-Motion Planning with ZIV Constraint,"The number of DOF is very vital for a manipulator. A manipulator is kinematically and/or functionally redundant when more DOF are available than the minimum number required to perform the primary task of a specific manipulator. Compared with a non-redundant manipulator, a redundant manipulator has wider operational space and extra degrees to configure the manipulator to meet additional functional constraints without affecting the position (and/or orientation) of the end-effector. Therefore, much attention and effort in the robotic research community have been paid to studies on and applications of redundant robot manipulators.",2017,Robot Manipulator Redundancy Resolution,,10.1115/1.861rob_ch11,,https://doi.org/10.1115/1.861rob_ch11,crossref,robot world model failure planning,hostile,failure,,,robot world model; motion planning; robot world model failure,2026-06-12T14:45:03Z,15.350,20.350
doi:10.1038/s42003-021-01955-z,An integrated multimodal model of alcohol use disorder generated by data-driven causal discovery analysis,"Abstract Alcohol use disorder (AUD) has high prevalence and adverse societal impacts, but our understanding of the factors driving AUD is hampered by a lack of studies that describe the complex neurobehavioral mechanisms driving AUD. We analyzed causal pathways to AUD severity using Causal Discovery Analysis (CDA) with data from the Human Connectome Project (HCP; n = 926 [54% female], 22% AUD [37% female]). We applied exploratory factor analysis to parse the wide HCP phenotypic space (100 measures) into 18 underlying domains, and we assessed functional connectivity within 12 resting-state brain networks. We then employed data-driven CDA to generate a causal model relating phenotypic factors, fMRI network connectivity, and AUD symptom severity, which highlighted a limited set of causes of AUD. The model proposed a hierarchy with causal influence propagating from brain connectivity to cogn",2021,Communications Biology,Eric Rawls; Erich Kummerfeld; Anna Zilverstand,10.1038/s42003-021-01955-z,,https://doi.org/10.1038/s42003-021-01955-z,crossref,causal robot world model,concept,architecture,,39,robot world model; causal robot world model,2026-06-12T15:07:36Z,15.344,16.344
doi:10.3390/pr10040728,A Novel Point-to-Point Trajectory Planning Algorithm for Industrial Robots Based on a Locally Asymmetrical Jerk Motion Profile,"Suitable trajectories with minimum execution time are essential for an industrial robot to enhance productivity in pick and place operations. A novel point-to-point trajectory planning algorithm (PTPA) is proposed to improve the motion efficiency of industrial robots. The jerk profile for a trajectory model is determined by five intervals and the jerk constraint. According to the kinematic constraints and two shape coefficients, a velocity threshold and three displacement thresholds are calculated for an individual joint to transfer the proposed jerk motion profile into four specific profiles. The optimal trajectory model of the joint is developed for the minimum-time and jerk-continuous trajectory via the performance evaluation with the input displacement and three displacement thresholds. Moreover, time-based motion synchronization for all joints is taken into account in PTPA to decrea",2022,Processes,Zhijun Wu; Jiaoliao Chen; Tingting Bao; Jiacai Wang; Libin Zhang; Fang Xu,10.3390/pr10040728,,https://doi.org/10.3390/pr10040728,crossref,sampling based motion planning,anti_myopia,anti_thesis,,28,industrial robot; motion planning; sampling based motion planning,2026-06-12T15:07:36Z,15.334,20.334
doi:10.3390/ijerph17103403,4D-BIM-Based Workspace Planning for Temporary Safety Facilities in Construction SMEs,"Temporary safety facilities (TSFs) are an essential support system providing necessary protection to workers during construction activities, which are targeted towards preventing the occurrence of incidents and accidents at the construction site; however, the schedule and location of installation and demolition of TSFs continue to rely on labor experience, and are often omitted from formal drawings or documents. This results in thousands of accidents in the construction industry, especially in construction small and medium-sized enterprises (SMEs) because of their several limiting factors; therefore, this study proposes automatic workspace planning for TSFs based on construction activities, which is a systematized approach for construction SMEs to practice occupational health and safety (OHS). By using building information modeling (BIM) and add-in algorithm, safety facilities can be sim",2020,International Journal of Environmental Research and Public Health,Kieu Trang Pham; Duc‐Nghia Vu; Phuc Le Hieu Hong; Chansik Park,10.3390/ijerph17103403,,https://doi.org/10.3390/ijerph17103403,openalex,energy based model robot learning,concept,ebm,,51,,2026-06-12T18:26:24Z,15.326,15.326
doi:10.1080/09638199.2021.2018021,Use of industrial robots and Chinese enterprises’ export quality upgrading: Evidence from China,"Using the micro-level data on China’s export enterprises from 2005 to 2013, this paper discusses the impact of industrial robots on the quality upgrading of export products from two aspects: the change of enterprises’ costs and the structural effect of labor allocation. We find that there is a U-shaped relationship between the use of industrial robots and export products’ quality upgrading, but the enterprises whose robot applications exceed the U-shaped inflection point only account for 22.68%; in other words, most enterprises have not yet realized export products quality upgrading, and there exists a mismatched effect in the initial development stage. The results of mechanism analysis showed that industrial robots have significant effects on the costs and the structure of labor for export enterprises.",2022,Journal of International Trade & Economic Development,Lianying Hong; Xujun Liu; Huiwen Zhan; Feng Han,10.1080/09638199.2021.2018021,,https://doi.org/10.1080/09638199.2021.2018021,openalex,robotics,concept,openalex_bulk_robotics,,45,industrial robot,2026-06-12T18:57:17Z,15.314,15.314
doi:10.1108/ir-04-2025-0142,Vision-based human–robot object handover in dynamic environments: a safety-aware framework with real-time anthropomorphic planning,"Purpose Dynamic human–robot object handover faces challenges such as insufficient generalization capability, limited real-time performance and safety concerns in practical applications. This paper aims to propose a vision-based human–robot object handover system to execute object handovers from a human worker to a robot more safely, efficiently and fluently in dynamic scenarios. Design/methodology/approach The proposed system takes images captured by a single RGB-D camera to complete object handover scene understanding. Putting a high emphasis on efficiency and safety, a novel lightweight EMA-UNet network is designed for efficient and high-precision hand segmentation and GR-ConvNet network is used for grasp detection. To maximize fluency of human–robot object handover, an anthropomorphic trajectory planning method based on dynamic movement primitives (DMPs) is used in this system. Experi",2026,Industrial Robot: the international journal of robotics research and application,Hang Zhao; Yuanyuan Zou; Jilong Zhang,10.1108/ir-04-2025-0142,,https://doi.org/10.1108/ir-04-2025-0142,crossref,robot world model failure planning,hostile,failure,,,robot world model; generalization; robot world model failure,2026-06-12T15:07:36Z,15.300,20.300
doi:10.1016/j.automatica.2024.111921,Soft-minimum and soft-maximum barrier functions for safety with actuation constraints,,2025,Automatica,Pedram Rabiee; Jesse B. Hoagg,10.1016/j.automatica.2024.111921,,https://doi.org/10.1016/j.automatica.2024.111921,crossref,control barrier functions robot learning,anti_myopia,control,,8,control barrier function,2026-06-12T15:07:36Z,15.299,18.299
doi:10.3390/s20020426,An Autonomous Path Planning Model for Unmanned Ships Based on Deep Reinforcement Learning,"Deep reinforcement learning (DRL) has excellent performance in continuous control problems and it is widely used in path planning and other fields. An autonomous path planning model based on DRL is proposed to realize the intelligent path planning of unmanned ships in the unknown environment. The model utilizes the deep deterministic policy gradient (DDPG) algorithm, through the continuous interaction with the environment and the use of historical experience data; the agent learns the optimal action strategy in a simulation environment. The navigation rules and the ship’s encounter situation are transformed into a navigation restricted area, so as to achieve the purpose of planned path safety in order to ensure the validity and accuracy of the model. Ship data provided by ship automatic identification system (AIS) are used to train this path planning model. Subsequently, the improved DRL",2020,Sensors,Siyu Guo; Xiuguo Zhang; Yisong Zheng; Yiquan Du,10.3390/s20020426,,https://doi.org/10.3390/s20020426,crossref,model based reinforcement learning robotics,concept,architecture,,193,model based reinforcement learning robotics,2026-06-12T15:07:36Z,15.284,15.284
doi:10.1007/s10514-019-09890-z,Multi-robot information driven path planning under communication constraints,,2020,Autonomous Robots,Bradley Woosley; Prithviraj Dasgupta; John G. Rogers; Jeffrey Twigg,10.1007/s10514-019-09890-z,,https://doi.org/10.1007/s10514-019-09890-z,crossref,robot world model failure planning,hostile,failure,,28,robot world model; robot world model failure,2026-06-12T15:07:36Z,15.284,19.284
doi:10.3389/fchem.2021.614073,Use of Artificial Intelligence and Machine Learning for Discovery of Drugs for Neglected Tropical Diseases,"Neglected tropical diseases continue to create high levels of morbidity and mortality in a sizeable fraction of the world's population, despite ongoing research into new treatments. Some of the most important technological developments that have accelerated drug discovery for diseases of affluent countries have not flowed down to neglected tropical disease drug discovery. Pharmaceutical development business models, cost of developing new drug treatments and subsequent costs to patients, and accessibility of technologies to scientists in most of the affected countries are some of the reasons for this low uptake and slow development relative to that for common diseases in developed countries. Computational methods are starting to make significant inroads into discovery of drugs for neglected tropical diseases due to the increasing availability of large databases that can be used to train M",2021,Frontiers in Chemistry,David A. Winkler,10.3389/fchem.2021.614073,,https://doi.org/10.3389/fchem.2021.614073,openalex,energy based model robot learning,concept,ebm,,62,,2026-06-12T18:26:24Z,15.272,15.272
doi:10.1109/tac.2022.3151846,Adaptive Constrained Formation-Tracking Control for a Tractor-Trailer Mobile Robot Team With Multiple Constraints,"A team of multiple tractor–trailer mobile robots has many applications in areas including agriculture, logistics, transportation, etc. In this article, we propose a novel adaptive constrained formation-tracking control algorithm for the trailers in a tractor–trailer mobile robot team to track a desired formation, while satisfying multiple precision , safety , and feasibility constraint requirements during the operation. Both universal barrier function approaches and a novel state transformation scheme are incorporated to deal with constraints of different nature. Adaptive estimators are introduced to estimate the rate of change of the desired trajectories for all trailers. We show that exponential convergence to a small neighborhood of the equilibrium can be guaranteed. In the end, a MATLAB simulation example and a Gazebo simulator study further demonstrate the efficacy of the proposed a",2022,IEEE Transactions on Automatic Control,Xu Jin; Shi‐Lu Dai; Jianjun Liang,10.1109/tac.2022.3151846,,https://doi.org/10.1109/tac.2022.3151846,openalex,robotics,concept,openalex_bulk_robotics,,74,,2026-06-12T18:57:17Z,15.259,15.259
doi:10.1177/0278364914528132,Motion planning with sequential convex optimization and convex collision checking,"We present a new optimization-based approach for robotic motion planning among obstacles. Like CHOMP (Covariant Hamiltonian Optimization for Motion Planning), our algorithm can be used to find collision-free trajectories from naïve, straight-line initializations that might be in collision. At the core of our approach are (a) a sequential convex optimization procedure, which penalizes collisions with a hinge loss and increases the penalty coefficients in an outer loop as necessary, and (b) an efficient formulation of the no-collisions constraint that directly considers continuous-time safety Our algorithm is implemented in a software package called TrajOpt. We report results from a series of experiments comparing TrajOpt with CHOMP and randomized planners from OMPL, with regard to planning time and path quality. We consider motion planning for 7 DOF robot arms, 18 DOF full-body robots, st",2014,The International Journal of Robotics Research,John Schulman; Yan Duan; Jonathan Ho; Alex Lee; Ibrahim Awwal; Henry Bradlow; Jia Pan; Sachin Patil; Ken Goldberg; Pieter Abbeel,10.1177/0278364914528132,,https://doi.org/10.1177/0278364914528132,crossref,task and motion planning robotics,anti_myopia,classic,,724,humanoid robot; motion planning; task and motion planning,2026-06-12T15:07:36Z,15.250,19.250
arxiv:1703.05019v1,Finding a Feasible Initial Solution for Flatness-Based Multi-Link Manipulator Motion Planning under State and Control Constraints,"In this paper, we present a method to initialize at a feasible point and unfailingly solve a non-convex optimization problem in which a set-point motion is planned for a multi-link manipulator under state and control constraints. We construct an initial feasible solution by analyzing the final time effect for feasibility problems of flatness based motion planning problems. More specifically, we first find a feasible time-optimal trajectory under state constraints without a control constraint by solving a linear programming problem. Then, we find a feasible trajectory under control constraints by scaling the trajectory. To evaluate the practical applicability of the proposed method, we did numerical experiments to solve a multi-link manipulator motion planning problem by combining the method with recursive inverse dynamics algorithms.",2017,arXiv,Keisuke Uto; Makoto Obayashi; Gaku Takano,,1703.05019v1,http://arxiv.org/abs/1703.05019v1,arxiv,embodied world model planning control,concept,world_models,,,motion planning,2026-06-12T14:45:03Z,15.250,17.250
doi:10.1007/s10846-024-02085-4,Trading-Off Safety with Agility Using Deep Pose Error Estimation and Reinforcement Learning for Perception-Driven UAV Motion Planning,"Abstract Navigation and planning for unmanned aerial vehicles (UAVs) based on visual-inertial sensors has been a popular research area in recent years. However, most visual sensors are prone to high error rates when exposed to disturbances such as excessive brightness and blur, which can lead to catastrophic performance drops in perception and motion planning systems. This study proposes a novel framework to address the coupled perception-planning problem in high-risk environments. This achieved by developing algorithms that can automatically adjust the agility of the UAV maneuvers based on the predicted error rate of the pose estimation system. The fundamental idea behind our work is to demonstrate that highly agile maneuvers become infeasible to execute when visual measurements are noisy. Thus, agility should be traded-off with safety to enable efficient risk management. Our study focu",2024,Journal of Intelligent & Robotic Systems,Mehmetcan Kaymaz; Recep Ayzit; Onur Akgün; Kamil Canberk Atik; Mustafa Erdem; Baris Yalcin; Gürkan Cetin; Nazım Kemal Ure,10.1007/s10846-024-02085-4,,https://doi.org/10.1007/s10846-024-02085-4,crossref,robot planning without learning,anti_myopia,anti_thesis,,2,motion planning; robot planning without learning,2026-06-12T15:07:36Z,15.249,19.249
doi:10.3390/act13020075,An Informed-Bi-Quick RRT* Algorithm Based on Offline Sampling: Motion Planning Considering Multiple Constraints for a Dual-Arm Cooperative System,"Aiming to address problems such as low sampling success rate and long computation time in the motion planning of a dual-arm cooperative system with multiple constraints, this paper proposes an Informed-Bi-Quick RRT* algorithm based on offline sampling. First, in the process of pre-sampling, the new algorithm relaxes the approximation of constrained manifolds by introducing the idea of incremental construction, and it incorporates the stochastic gradient descent method to replace global random sampling with local random sampling, which enriches the data set and shortens the offline sampling time of the data set. Second, the new algorithm improves the original Quick-RRT* algorithm by combining the two-tree idea and the multi-target bias expansion strategy, and it improves the adaptability of the algorithm to different obstacle environments. In addition, the loosely constrained motion and t",2024,Actuators,Qinglei Zhang; Yunfeng Liu; Jiyun Qin; Jianguo Duan,10.3390/act13020075,,https://doi.org/10.3390/act13020075,crossref,sampling based motion planning,anti_myopia,anti_thesis,,2,motion planning; sampling based motion planning,2026-06-12T15:07:36Z,15.249,19.249
doi:10.3390/s24165166,SPIN-Based Linear Temporal Logic Path Planning for Ground Vehicle Missions with Motion Constraints on Digital Elevation Models,"Linear temporal logic (LTL) formalism can ensure the correctness of mobile robot planning through concise, readable, and verifiable mission specifications. For uneven terrain, planning must consider motion constraints related to asymmetric slope traversability and maneuverability. However, even though model checker tools like the open-source Simple Promela Interpreter (SPIN) include search optimization techniques to address the state explosion problem, defining a global LTL property that encompasses both mission specifications and motion constraints on digital elevation models (DEMs) can lead to complex models and high computation times. In this article, we propose a system model that incorporates a set of uncrewed ground vehicle (UGV) motion constraints, allowing these constraints to be omitted from LTL model checking. This model is used in the LTL synthesizer for path planning, where a",2024,Sensors,Manuel Toscano-Moreno; Anthony Mandow; María Alcázar Martínez; Alfonso José García-Cerezo,10.3390/s24165166,,https://doi.org/10.3390/s24165166,crossref,sampling based motion planning,anti_myopia,anti_thesis,,2,motion planning; sampling based motion planning,2026-06-12T15:07:36Z,15.249,19.249
doi:10.1016/j.rcim.2020.101969,Time-optimal tool motion planning with tool-tip kinematic constraints for robotic machining of sculptured surfaces,,2020,Robotics and Computer-Integrated Manufacturing,Lei Lu; Jiong Zhang; Jerry Ying Hsi Fuh; Jiang Han; Hao Wang,10.1016/j.rcim.2020.101969,,https://doi.org/10.1016/j.rcim.2020.101969,crossref,task and motion planning robotics,anti_myopia,classic,,59,motion planning; task and motion planning,2026-06-12T15:07:36Z,15.247,19.247
doi:10.3390/robotics14030032,Enhanced Hybrid Artificial Fish Swarm Algorithm for Three-Dimensional Path Planning Applied to Robotic Systems,"Path planning is a vital challenge in robot navigation. In the real world, robots operate in 3D environments with various obstacles and restrictions. An improved artificial fish swarm algorithm (AFSA) is proposed to solve 3D path planning problems in environments with obstacles. The improved AFSA incorporates a 3D model of 24 possible movement points to more realistically simulate real-world robot movement capabilities. Several improvements are adopted, such as methods of simple and advanced 3D elimination. The 3D implementation of an agent’s navigation model, called an “obstacle heatmap”, is also presented. The use of a safety value factor and a total movement point factor in the AFSA’s objective function are introduced. The combination of improved AFSA and a ray-casting algorithm is also presented. Finally, a method called “multiple laser activation” is introduced to overcome both the ",2025,Robotics,Ilias Chouridis; Gabriel Mansour; Vasileios Papageorgiou; Michel Theodor Mansour; Apostolos Tsagaris,10.3390/robotics14030032,,https://doi.org/10.3390/robotics14030032,crossref,hybrid dynamical systems robotics,anti_myopia,anti_thesis,,6,industrial robot; limitation; hybrid dynamical systems robotics,2026-06-12T15:07:36Z,15.223,20.223
doi:10.1002/rob.22130,Kinematic coupling‐based trajectory planning for rotary crane system with double‐pendulum effects and output constraints,"Abstract When the payload is too large or the hook mass cannot be ignored, the double‐pendulum phenomenon may happen in rotary cranes practical applications. The increase in dynamic complexity makes it more difficult to fast and accurate positioning while suppressing swing during cargo transportation. Moreover, output constraints should be considered in actual crane systems. In this paper, a novel kinematic coupling‐based trajectory planning method is proposed for double‐pendulum rotary cranes with the constraints on angular acceleration and velocity of the boom. The proposed trajectory consists of two parts: a positioning reference component and a swing‐eliminating component. The positioning reference trajectory takes into account the physical constraints of the actuator. The swing‐eliminating trajectory is designed based on the kinematic coupling relationship among the boom luffing, th",2023,Journal of Field Robotics,Gang Li; Xin Ma; Zhi Li; Peijun Guo; Yibin Li,10.1002/rob.22130,,https://doi.org/10.1002/rob.22130,crossref,neural radiance field robotics,concept,architecture,,13,neural radiance field robotics; robustness,2026-06-12T15:07:36Z,15.220,16.220
doi:10.1109/icra57147.2024.10611099,Neural Informed RRT*: Learning-based Path Planning with Point Cloud State Representations under Admissible Ellipsoidal Constraints,,2024,2024 IEEE International Conference on Robotics and Automation (ICRA),Zhe Huang; Hongyu Chen; John Pohovey; Katherine Driggs-Campbell,10.1109/icra57147.2024.10611099,,https://doi.org/10.1109/icra57147.2024.10611099,crossref,neural simulator robotics,concept,architecture,,37,neural simulator robotics,2026-06-12T15:07:36Z,15.219,15.219
doi:10.3389/frobt.2021.627958,Do Privacy Concerns About Social Robots Affect Use Intentions? Evidence From an Experimental Vignette Study,"While the privacy implications of social robots have been increasingly discussed and privacy-sensitive robotics is becoming a research field within human–robot interaction, little empirical research has investigated privacy concerns about robots and the effect they have on behavioral intentions. To address this gap, we present the results of an experimental vignette study that includes antecedents from the privacy, robotics, technology adoption, and trust literature. Using linear regression analysis, with the privacy-invasiveness of a fictional but realistic robot as the key manipulation, we show that privacy concerns affect use intention significantly and negatively. Compared with earlier work done through a survey, where we found a robot privacy paradox, the experimental vignette approach allows for a more realistic and tangible assessment of respondents' concerns and behavioral intent",2021,Frontiers in Robotics and AI,Christoph Lutz; Aurelia Tamò-Larrieux,10.3389/frobt.2021.627958,,https://doi.org/10.3389/frobt.2021.627958,crossref,Gaussian splatting robot perception tool use robotics,concept,architecture_x_embodiment,,61,Gaussian splatting robot perception; tool use robotics; human robot interaction,2026-06-12T15:07:36Z,15.214,16.214
doi:10.1109/access.2023.3249966,An Overview of Machine Learning Techniques in Local Path Planning for Autonomous Underwater Vehicles,"Autonomous underwater vehicles (AUVs) have become attractive and essential for underwater search and exploration because of the advantages they offer over manned underwater vehicles. Hence the need to improve AUV technologies. One crucial area of AUV technology involves efficiently solving the path planning problem. Several approaches have been identified from the literature for AUV global and local path planning. The use of machine learning (ML) techniques in overcoming some of the challenges associated with AUV path planning problems such as safety and obstacle avoidance, energy consumption, and optimal time and distance travelled remains an active research area. While there is literature on global and local path planning that explores different techniques, there is still a lack of paper that provides an overview of the application of ML for local path planning. Hence the main objectiv",2023,IEEE Access,Chinonso Okereke; Mohd Murtadha Mohamad; Nur Haliza Abdul Wahab; Olakunle Elijah; Abdulaziz Al-Nahari; S. Zaleha.H,10.1109/access.2023.3249966,,https://doi.org/10.1109/access.2023.3249966,openalex,energy based model robot learning,concept,ebm,,44,deployment,2026-06-12T18:26:24Z,15.203,16.203
