uid,title,abstract,year,venue,authors,doi,arxiv_id,url,source,query,query_role,family,advisor_seed,citation_count,matched_terms,retrieved_at,relevance_score,hostile_score
doi:10.3390/s21030796,Learning-Based End-to-End Path Planning for Lunar Rovers with Safety Constraints,"Path planning is an essential technology for lunar rover to achieve safe and efficient autonomous exploration mission, this paper proposes a learning-based end-to-end path planning algorithm for lunar rovers with safety constraints. Firstly, a training environment integrating real lunar surface terrain data was built using the Gazebo simulation environment and a lunar rover simulator was created in it to simulate the real lunar surface environment and the lunar rover system. Then an end-to-end path planning algorithm based on deep reinforcement learning method is designed, including state space, action space, network structure, reward function considering slip behavior, and training method based on proximal policy optimization. In addition, to improve the generalization ability to different lunar surface topography and different scale environments, a variety of training scenarios were se",2021,Sensors,Xiaoqiang Yu; Ping Wang; Zexu Zhang,10.3390/s21030796,,https://doi.org/10.3390/s21030796,openalex,energy based model robot learning,concept,ebm,,61,safety constraint; generalization,2026-06-12T18:05:07Z,22.964,23.964
doi:10.24963/ijcai.2019/68,Multi-Robot Planning Under Uncertain Travel Times and Safety Constraints,"We present a novel modelling and planning approach for multi-robot systems under uncertain travel times. The approach uses generalised stochastic Petri nets (GSPNs) to model desired team behaviour, and allows to specify safety constraints and rewards. The GSPN is interpreted as a Markov decision process (MDP) for which we can generate policies that optimise the requirements. This representation is more compact than the equivalent multi-agent MDP, allowing us to scale better. Furthermore, it naturally allows for asynchronous execution of the generated policies across the robots, yielding smoother team behaviour. We also describe how the integration of the GSPN with a lower-level team controller allows for accurate expectations on team performance. We evaluate our approach on an industrial scenario, showing that it outperforms hand-crafted policies used in current practice.",2019,,Masoumeh Mansouri; Bruno Lacerda; Nick Hawes; Federico Pecora,10.24963/ijcai.2019/68,,https://doi.org/10.24963/ijcai.2019/68,openalex,robotics,concept,openalex_bulk_robotics,,17,multi robot system; safety constraint,2026-06-12T18:57:17Z,21.945,21.945
doi:10.1109/icra40945.2020.9196857,Wasserstein Distributionally Robust Motion Planning and Control with Safety Constraints Using Conditional Value-at-Risk,,2020,2020 IEEE International Conference on Robotics and Automation (ICRA),Astghik Hakobyan; Insoon Yang,10.1109/icra40945.2020.9196857,,https://doi.org/10.1109/icra40945.2020.9196857,crossref,task and motion planning robotics,anti_myopia,classic,,15,safety constraint; motion planning; task and motion planning,2026-06-12T15:07:36Z,21.586,25.586
doi:10.1016/j.robot.2025.105109,Coverage Trajectory Planning Problem on 3D Terrains with safety constraints for automated lawn mower: Exact and heuristic approaches,,2025,Robotics and Autonomous Systems,Hang Zhou; Peng Zhang; Zhaohui Liang; Hangyu Li; Xiaopeng Li,10.1016/j.robot.2025.105109,,https://doi.org/10.1016/j.robot.2025.105109,crossref,robotics,concept,crossref_bulk_robotics,,4,safety constraint,2026-06-12T19:29:26Z,21.405,21.405
doi:10.1109/icra57147.2024.10611158,Parallel Optimization with Hard Safety Constraints for Cooperative Planning of Connected Autonomous Vehicles,,2024,2024 IEEE International Conference on Robotics and Automation (ICRA),Zhenmin Huang; Haichao Liu; Shaojie Shen; Jun Ma,10.1109/icra57147.2024.10611158,,https://doi.org/10.1109/icra57147.2024.10611158,crossref,robotics,concept,crossref_bulk_robotics,,4,safety constraint,2026-06-12T19:29:26Z,21.205,21.205
doi:10.23919/ccc58697.2023.10241009,Time Optimal Planning-Based High-Speed Running Motion Generation for Humanoid Robots with Safety Constraints,,2023,2023 42nd Chinese Control Conference (CCC),Dingkun Liang; Chengzhi Gao; Ye Xie; Yulong Cui; Anhuan Xie; Yiming Wu; Jason Gu,10.23919/ccc58697.2023.10241009,,https://doi.org/10.23919/ccc58697.2023.10241009,crossref,sampling based motion planning,anti_myopia,anti_thesis,,,humanoid robot; safety constraint; motion planning; sampling based motion planning,2026-06-12T15:07:36Z,20.800,24.800
doi:10.1109/icra.2013.6630692,Provably-correct stochastic motion planning with safety constraints,,2013,2013 IEEE International Conference on Robotics and Automation,Chanyeol Yoo; Robert Fitch; Salah Sukkarieh,10.1109/icra.2013.6630692,,https://doi.org/10.1109/icra.2013.6630692,crossref,task and motion planning robotics,anti_myopia,classic,,18,safety constraint; motion planning; task and motion planning,2026-06-12T15:07:36Z,20.672,24.672
doi:10.1109/icma54519.2022.9856048,Laparoscopic automatic following motion planning of minimally invasive surgery robot based on safety constraints,,2022,2022 IEEE International Conference on Mechatronics and Automation (ICMA),Shuizhong Zou; Yuan Huang; Ziang Wang,10.1109/icma54519.2022.9856048,,https://doi.org/10.1109/icma54519.2022.9856048,crossref,sampling based motion planning,anti_myopia,anti_thesis,,,safety constraint; motion planning; sampling based motion planning,2026-06-12T15:07:36Z,20.600,24.600
doi:10.1109/icar.2015.7251458,Model predictive path planning with time-varying safety constraints for highway autonomous driving,,2015,2015 International Conference on Advanced Robotics (ICAR),Mehdi Jalalmaab; Baris Fidan; Soo Jeon; Paolo Falcone,10.1109/icar.2015.7251458,,https://doi.org/10.1109/icar.2015.7251458,crossref,robotics,concept,crossref_bulk_robotics,,27,safety constraint,2026-06-12T19:29:26Z,20.266,21.266
doi:10.1108/ir-10-2023-0251,An efficient constraint method for solving planning problems under end-effector constraints,"Purpose In response to the challenge of reduced efficiency or failure of robot motion planning algorithms when faced with end-effector constraints, this study aims to propose a new constraint method to improve the performance of the sampling-based planner. Design/methodology/approach In this work, a constraint method (TC method) based on the idea of cross-sampling is proposed. This method uses the tangent space in the workspace to approximate the constrained manifold pattern and projects the entire sampling process into the workspace for constraint correction. This method avoids the need for extensive computational work involving multiple iterations of the Jacobi inverse matrix in the configuration space and retains the sampling properties of the sampling-based algorithm. Findings Simulation results demonstrate that the performance of the planner when using the TC method under the end-ef",2024,Industrial Robot: the international journal of robotics research and application,Yahao Wang; Zhen Li; Yanghong Li; Erbao Dong,10.1108/ir-10-2023-0251,,https://doi.org/10.1108/ir-10-2023-0251,crossref,EBM transformer robotics industrial robot,concept,architecture_x_embodiment,,3,EBM transformer robotics; industrial robot; motion planning,2026-06-12T15:07:36Z,20.143,22.143
doi:10.1109/icra.2018.8460185,Collision-Free Motion Planning for Human-Robot Collaborative Safety Under Cartesian Constraint,,2018,2018 IEEE International Conference on Robotics and Automation (ICRA),Jen-Hao Chen; Kai-Tai Song,10.1109/icra.2018.8460185,,https://doi.org/10.1109/icra.2018.8460185,crossref,task and motion planning robotics,anti_myopia,classic,,68,motion planning; task and motion planning,2026-06-12T15:07:36Z,19.917,23.917
doi:10.1016/j.robot.2024.104823,Identification of physically consistent dynamics parameter of the ABB IRB 360-6/1600 delta robot and its use for time-optimal motion planning under consideration of constraint forces,,2024,Robotics and Autonomous Systems,Daniel Gnad; Hubert Gattringer; Andreas Müller; Wolfgang Höbarth; Roland Riepl; Lukas Meßner,10.1016/j.robot.2024.104823,,https://doi.org/10.1016/j.robot.2024.104823,crossref,task and motion planning robotics,anti_myopia,classic,,3,motion planning; task and motion planning,2026-06-12T15:07:36Z,19.693,23.693
doi:10.3390/e27010038,A Novel Hyper-Heuristic Algorithm with Soft and Hard Constraints for Causal Discovery Using a Linear Structural Equation Model,"Artificial intelligence plays an indispensable role in improving productivity and promoting social development, and causal discovery is one of the extremely important research directions in this field. Acyclic directed graphs (DAGs) are the most commonly used tool in causal modeling because of their excellent interpretability and structural properties. However, in the face of insufficient data, the accuracy and efficiency of DAGs learning are greatly reduced, resulting in a false perception of causality. As intuitive expert knowledge, structural constraints control DAG learning by limiting the causal relationship between variables, which is expected to solve the above-mentioned problem. However, it is often impossible to build a DAG by relying on expert knowledge alone. To solve this problem, we propose the use of expert knowledge as a hard constraint and the structural prior gained via ",2025,Entropy,Yinglong Dang; Xiaoguang Gao; Zidong Wang,10.3390/e27010038,,https://doi.org/10.3390/e27010038,crossref,causal robot world model,concept,architecture,,2,robot world model; causal robot world model,2026-06-12T15:07:36Z,19.549,20.549
doi:10.1109/icra57147.2024.10611447,Plug in the Safety Chip: Enforcing Constraints for LLM-driven Robot Agents,"Recent advancements in large language models (LLMs) have enabled a new research domain, LLM agents, for solving robotics and planning tasks by leveraging the world knowledge and general reasoning abilities of LLMs obtained during pretraining. However, while considerable effort has been made to teach the robot the ""dos"", the ""don’ts"" received relatively less attention. We argue that, for any practical usage, it is as crucial to teach the robot the ""don’ts"": conveying explicit instructions about prohibited actions, assessing the robot’s comprehension of these restrictions, and, most importantly, ensuring compliance. Moreover, verifiable safe operation is essential for deployments that satisfy worldwide standards such as ISO 61508, which defines standards for safely deploying robots in industrial factory environments worldwide. Aiming at deploying the LLM agents in a collaborative environme",2024,,Ziyi Yang; Shreyas Sundara Raman; Ankit Shah; Stefanie Tellex,10.1109/icra57147.2024.10611447,,https://doi.org/10.1109/icra57147.2024.10611447,openalex,robotics,concept,openalex_bulk_robotics,,31,safety constraint; deployment,2026-06-12T18:57:17Z,19.533,20.533
doi:10.1049/csy2.70004,Enhancing stability and safety: A novel multi‐constraint model predictive control approach for forklift trajectory,"Abstract The advancements in intelligent manufacturing have made high‐precision trajectory tracking technology crucial for improving the efficiency and safety of in‐factory cargo transportation. This study addresses the limitations of current forklift navigation systems in trajectory control accuracy and stability by proposing the Enhanced Stability and Safety Model Predictive Control (ESS‐MPC) method. This approach includes a multi‐constraint strategy for improved stability and safety. The kinematic model for a single front steering‐wheel forklift vehicle is constructed with all known state quantities, including the steering angle, resulting in a more accurate model description and trajectory prediction. To ensure vehicle safety, the spatial safety boundary obtained from the trajectory planning module is established as a hard constraint for ESS‐MPC tracking. The optimisation constraints",2024,IET Cyber-Systems and Robotics,Yizhen Sun; Junyou Yang; Donghui Zhao; Moses Chukwuka Okonkwo; Jianmin Zhang; Shuoyu Wang; Yang Liu,10.1049/csy2.70004,,https://doi.org/10.1049/csy2.70004,crossref,robotics,concept,crossref_bulk_robotics,,3,model predictive control; limitation,2026-06-12T19:29:26Z,19.493,21.493
doi:10.48550/arxiv.2103.14252,Toward Safety-Aware Informative Motion Planning for Legged Robots,"This paper reports on developing an integrated framework for safety-aware informative motion planning suitable for legged robots. The information-gathering planner takes a dense stochastic map of the environment into account, while safety constraints are enforced via Control Barrier Functions (CBFs). The planner is based on the Incrementally-exploring Information Gathering (IIG) algorithm and allows closed-loop kinodynamic node expansion using a Model Predictive Control (MPC) formalism. Robotic exploration and information gathering problems are inherently path-dependent problems. That is, the information collected along a path depends on the state and observation history. As such, motion planning solely based on a modular cost does not lead to suitable plans for exploration. We propose SAFE-IIG, an integrated informative motion planning algorithm that takes into account: 1) a robot's per",2021,arXiv (Cornell University),Sangli Teng; Yukai Gong; Jessy W. Grizzle; Maani Ghaffari,10.48550/arxiv.2103.14252,,https://doi.org/10.48550/arxiv.2103.14252,openalex,robotics,concept,openalex_bulk_robotics,,22,safety constraint; control barrier function; model predictive control; motion planning,2026-06-12T18:57:17Z,19.468,21.468
doi:10.58459/rptel.2026.21020,Causal discovery for automated real-world educational evidence extraction,"There is increasing demand to shift from intuition- and experience-based practices to evidence-based education. However, extracting meaningful evidence from real-world educational data poses significant challenges. Traditional approaches to evidence generation, such as randomized controlled trials and systematic reviews, face limitations in both the medical and educational domains due to high costs and ethical constraints. In response, the concept of real-world evidence has emerged as a promising alternative, particularly in medicine and, more recently, in education. Although this approach may be less robust than traditional methods, it offers the potential to uncover broad and practical insights from naturally occurring data. This study explores the use of deep learning for causal discovery in real-world educational data. Specifically, we apply Structural Agnostic Modeling, a method pre",2026,Research and Practice in Technology Enhanced Learning,Koki Okumura; Kento Nishioka; Kento Koike; Izumi Horikoshi; Hiroaki Ogata,10.58459/rptel.2026.21020,,https://doi.org/10.58459/rptel.2026.21020,crossref,causal robot world model,concept,architecture,,1,robot world model; causal robot world model; limitation,2026-06-12T15:07:36Z,19.347,22.347
arxiv:2406.16874v2,A Closed-Form Control for Safety Under Input Constraints Using a Composition of Control Barrier Functions,"We present a closed-form optimal control that satisfies both safety constraints (i.e., state constraints) and input constraints (e.g., actuator limits) using a composition of multiple control barrier functions (CBFs). This main contribution is obtained through the combination of several ideas. First, we present a method for constructing a single relaxed control barrier function (R-CBF) from multiple CBFs, which can have different relative degrees. The construction relies on a log-sum-exponential soft-minimum function and yields an R-CBF whose zero-superlevel set is a subset of the intersection of the zero-superlevel sets of all CBFs used in the composition. Next, we use the soft-minimum R-CBF to construct a closed-form control that is optimal with respect to a quadratic cost subject to the safety constraints. Finally, we use the soft-minimum R-CBF to develop a closed-form optimal control",2024,arXiv,Pedram Rabiee; Jesse B. Hoagg,,2406.16874v2,http://arxiv.org/abs/2406.16874v2,arxiv,control barrier functions robot learning,anti_myopia,control,,,safety constraint; control barrier function,2026-06-12T15:07:36Z,19.250,23.250
doi:10.1109/itsc60802.2025.11423203,A Real-Time Control Barrier Function-Based Safety Filter for Motion Planning with Arbitrary Road Boundary Constraints,,2025,2025 IEEE 28th International Conference on Intelligent Transportation Systems (ITSC),Jianye Xu; Chang Che; Bassam Alrifaee,10.1109/itsc60802.2025.11423203,,https://doi.org/10.1109/itsc60802.2025.11423203,crossref,sampling based motion planning,anti_myopia,anti_thesis,,,control barrier function; motion planning; sampling based motion planning,2026-06-12T15:07:36Z,19.200,23.200
doi:10.18280/mmep.090131,Motion Planning Solution with Constraints Based on Minimum Distance Model for Lane Change Problem of Autonomous Vehicles,"Lane change is one of the important operations in motion of an autonomous vehicle. When encountering obstacles or wanting to overtake the vehicle ahead, the autonomous vehicle will make a decision and choose the best path to control the trajectory of motion to perform lane change. In this article, we will present solutions for lane change trajectories, including general path setting, building nonlinear models with states of vehicle speed, acceleration and jerk; building a constraint set to avoid collisions with a minimum safe distance model, which takes into account the potentially collision angle positions during lane change. Simulation results are performed in Matlab simulation environment to demonstrate an effective proposed solution and addressed the disadvantages in the modeling process for lane-changing operations, in order to improve the proactive safety of the motion planning for",2022,Mathematical Modelling of Engineering Problems,Quach Hai Tho; Huynh Cong Phap; Pham Anh Phuong,10.18280/mmep.090131,,https://doi.org/10.18280/mmep.090131,crossref,sampling based motion planning,anti_myopia,anti_thesis,,2,motion planning; sampling based motion planning,2026-06-12T15:07:36Z,19.199,23.199
doi:10.3390/app16031500,Safety-Oriented Motion Planning for a Wheeled Humanoid Robot Operating in Environments with Stochastically Moving Humans,"With the advancement of humanoid robotics, human–robot collaboration has emerged as a prominent research focus. Ensuring the safety of both humanoid robots and humans remains a critical challenge. In this paper, we address conflict resolutions at the planning level and propose a safety-oriented motion planning (SOMP) algorithm for a wheeled humanoid robot operating in environments with unknown human motions. In the proposed SOMP algorithm, we employ Monte Carlo simulations to predict trajectories of stochastically moving humans and formulate both hard and soft constraints. A dynamic-quadrant stochastic sampling policy, integrated with a rapidly exploring random tree method, is proposed to generate diverse initial paths. Building upon this, we develop a constraint-fusion mechanism that combines hard constraints for safety guarantees and soft constraints for path optimization, thereby effe",2026,Applied Sciences,Jian Mi; Xianbo Zhang; Zhongjie Long; Jun Wang; Wei Xu,10.3390/app16031500,,https://doi.org/10.3390/app16031500,crossref,humanoid robot foundation model,concept,humanoid,,,robot foundation model; humanoid robot; motion planning; robustness,2026-06-12T15:07:36Z,19.000,21.000
doi:10.4114/intartif.vol21iss62pp25-39,A Constraint-based Mission Planning Approach for Reconfigurable Multi-Robot Systems,"The application of reconfigurable multi-robot systems introduces additional degrees of freedom to design robotic missions compared to classical multi-robot systems. To allow for autonomous operation of such systems, planning approaches have to be investigated that cannot only cope with the combinatorial challenge arising from the increased flexibility of modular systems, but also exploit this flexibility to improve for example the safety of operation. While the problem originates from the domain of robotics it is of general nature and significantly intersects with operations research. This paper suggests a constraint-based mission planning approach, and presents a set of revised definitions for reconfigurable multi-robot systems including the representation of the planning problem using spatially and temporally qualified resource constraints. Planning is performed using a multi-stage app",2018,Inteligencia Artificial,Thomas M Roehr,10.4114/intartif.vol21iss62pp25-39,,https://doi.org/10.4114/intartif.vol21iss62pp25-39,crossref,robot world model failure planning,hostile,failure,,1,robot world model; multi robot system; robot world model failure,2026-06-12T15:07:36Z,18.947,23.947
arxiv:2410.19656v1,APRICOT: Active Preference Learning and Constraint-Aware Task Planning with LLMs,"Home robots performing personalized tasks must adeptly balance user preferences with environmental affordances. We focus on organization tasks within constrained spaces, such as arranging items into a refrigerator, where preferences for placement collide with physical limitations. The robot must infer user preferences based on a small set of demonstrations, which is easier for users to provide than extensively defining all their requirements. While recent works use Large Language Models (LLMs) to learn preferences from user demonstrations, they encounter two fundamental challenges. First, there is inherent ambiguity in interpreting user actions, as multiple preferences can often explain a single observed behavior. Second, not all user preferences are practically feasible due to geometric constraints in the environment. To address these challenges, we introduce APRICOT, a novel approach t",2024,arXiv,Huaxiaoyue Wang; Nathaniel Chin; Gonzalo Gonzalez-Pumariega; Xiangwan Sun; Neha Sunkara; Maximus Adrian Pace; Jeannette Bohg; Sanjiban Choudhury,,2410.19656v1,http://arxiv.org/abs/2410.19656v1,arxiv,robot planning without learning,anti_myopia,anti_thesis,,,preference learning; limitation; robot planning without learning,2026-06-12T15:07:36Z,18.900,22.900
doi:10.1109/robot.2005.1570254,Constraint-Based Motion Planning of Deformable Robots,"We present a novel algorithm for motion planning of a deformable robot in a static environment. Given the initial and final configuration of the robot, our algorithm computes an approximate path using the probabilistic roadmap method. We use ""constraint-based planning"" to simulate robot deformation and make appropriate path adjustments and corrections to compute a collision-free path. Our algorithm takes into account geometric constraints like non-penetration and physical constraints like volume preservation. We highlight the performance of our planner on different scenarios of varying complexity.",2006,,Russell Gayle; Ming C. Lin; Dinesh Manocha,10.1109/robot.2005.1570254,,https://doi.org/10.1109/robot.2005.1570254,openalex,robotics,concept,openalex_bulk_robotics,,37,motion planning,2026-06-12T18:57:17Z,18.869,19.869
doi:10.3390/buildings14082511,Utilizing Large Language Models to Illustrate Constraints for Construction Planning,"Effective construction project planning relies on addressing constraints related to materials, labor, equipment, and others. Planning meetings are typical venues for stakeholders to identify, communicate, and remove constraints. However, a critical gap exists in lacking an automated approach to identify, classify, analyze, and track constraint discussions during onsite planning meetings. Therefore, this research aims to 1. develop a natural language processing model to classify constraints in meeting discussions; 2. uncover the discussion patterns of managers and foremen regarding various constraints; and 3. extract the root causes for constraints, evaluate their impacts, and prepare managers to develop practical solutions for constraint removal. This research collected meeting transcripts from 94 onsite planning meetings of a building project, spanning 263,836 words. Next, this research",2024,Buildings,Chuanni He; Bei Yu; Min Liu; Lu Guo; Li Tian; Jianfeng Huang,10.3390/buildings14082511,,https://doi.org/10.3390/buildings14082511,crossref,large language model limitation robot planning,anti_myopia,anti_thesis,,29,limitation; large language model limitation robot planning,2026-06-12T15:07:36Z,18.751,22.751
doi:10.1109/rcar65431.2025.11139711,Safety Constraint-Oriented Path Planning and Navigation Method for Substation Robots,,2025,2025 IEEE International Conference on Real-time Computing and Robotics (RCAR),Chengyuan Zhou; Kehan Li; Weijun Zhang,10.1109/rcar65431.2025.11139711,,https://doi.org/10.1109/rcar65431.2025.11139711,crossref,robotics,concept,crossref_bulk_robotics,,,safety constraint,2026-06-12T19:29:26Z,18.600,18.600
