uid,title,abstract,year,venue,authors,doi,arxiv_id,url,source,query,query_role,family,advisor_seed,citation_count,matched_terms,retrieved_at,relevance_score,hostile_score
doi:10.1109/icra40945.2020.9196857,Wasserstein Distributionally Robust Motion Planning and Control with Safety Constraints Using Conditional Value-at-Risk,,2020,2020 IEEE International Conference on Robotics and Automation (ICRA),Astghik Hakobyan; Insoon Yang,10.1109/icra40945.2020.9196857,,https://doi.org/10.1109/icra40945.2020.9196857,crossref,task and motion planning robotics,anti_myopia,classic,,15,safety constraint; motion planning; task and motion planning,2026-06-12T15:07:36Z,21.586,25.586
doi:10.23919/ccc58697.2023.10241009,Time Optimal Planning-Based High-Speed Running Motion Generation for Humanoid Robots with Safety Constraints,,2023,2023 42nd Chinese Control Conference (CCC),Dingkun Liang; Chengzhi Gao; Ye Xie; Yulong Cui; Anhuan Xie; Yiming Wu; Jason Gu,10.23919/ccc58697.2023.10241009,,https://doi.org/10.23919/ccc58697.2023.10241009,crossref,sampling based motion planning,anti_myopia,anti_thesis,,,humanoid robot; safety constraint; motion planning; sampling based motion planning,2026-06-12T15:07:36Z,20.800,24.800
doi:10.1109/icra.2013.6630692,Provably-correct stochastic motion planning with safety constraints,,2013,2013 IEEE International Conference on Robotics and Automation,Chanyeol Yoo; Robert Fitch; Salah Sukkarieh,10.1109/icra.2013.6630692,,https://doi.org/10.1109/icra.2013.6630692,crossref,task and motion planning robotics,anti_myopia,classic,,18,safety constraint; motion planning; task and motion planning,2026-06-12T15:07:36Z,20.672,24.672
doi:10.1109/icma54519.2022.9856048,Laparoscopic automatic following motion planning of minimally invasive surgery robot based on safety constraints,,2022,2022 IEEE International Conference on Mechatronics and Automation (ICMA),Shuizhong Zou; Yuan Huang; Ziang Wang,10.1109/icma54519.2022.9856048,,https://doi.org/10.1109/icma54519.2022.9856048,crossref,sampling based motion planning,anti_myopia,anti_thesis,,,safety constraint; motion planning; sampling based motion planning,2026-06-12T15:07:36Z,20.600,24.600
doi:10.3390/s21030796,Learning-Based End-to-End Path Planning for Lunar Rovers with Safety Constraints,"Path planning is an essential technology for lunar rover to achieve safe and efficient autonomous exploration mission, this paper proposes a learning-based end-to-end path planning algorithm for lunar rovers with safety constraints. Firstly, a training environment integrating real lunar surface terrain data was built using the Gazebo simulation environment and a lunar rover simulator was created in it to simulate the real lunar surface environment and the lunar rover system. Then an end-to-end path planning algorithm based on deep reinforcement learning method is designed, including state space, action space, network structure, reward function considering slip behavior, and training method based on proximal policy optimization. In addition, to improve the generalization ability to different lunar surface topography and different scale environments, a variety of training scenarios were se",2021,Sensors,Xiaoqiang Yu; Ping Wang; Zexu Zhang,10.3390/s21030796,,https://doi.org/10.3390/s21030796,openalex,energy based model robot learning,concept,ebm,,61,safety constraint; generalization,2026-06-12T18:05:07Z,22.964,23.964
doi:10.4114/intartif.vol21iss62pp25-39,A Constraint-based Mission Planning Approach for Reconfigurable Multi-Robot Systems,"The application of reconfigurable multi-robot systems introduces additional degrees of freedom to design robotic missions compared to classical multi-robot systems. To allow for autonomous operation of such systems, planning approaches have to be investigated that cannot only cope with the combinatorial challenge arising from the increased flexibility of modular systems, but also exploit this flexibility to improve for example the safety of operation. While the problem originates from the domain of robotics it is of general nature and significantly intersects with operations research. This paper suggests a constraint-based mission planning approach, and presents a set of revised definitions for reconfigurable multi-robot systems including the representation of the planning problem using spatially and temporally qualified resource constraints. Planning is performed using a multi-stage app",2018,Inteligencia Artificial,Thomas M Roehr,10.4114/intartif.vol21iss62pp25-39,,https://doi.org/10.4114/intartif.vol21iss62pp25-39,crossref,robot world model failure planning,hostile,failure,,1,robot world model; multi robot system; robot world model failure,2026-06-12T15:07:36Z,18.947,23.947
doi:10.1109/icra.2018.8460185,Collision-Free Motion Planning for Human-Robot Collaborative Safety Under Cartesian Constraint,,2018,2018 IEEE International Conference on Robotics and Automation (ICRA),Jen-Hao Chen; Kai-Tai Song,10.1109/icra.2018.8460185,,https://doi.org/10.1109/icra.2018.8460185,crossref,task and motion planning robotics,anti_myopia,classic,,68,motion planning; task and motion planning,2026-06-12T15:07:36Z,19.917,23.917
doi:10.1016/j.robot.2024.104823,Identification of physically consistent dynamics parameter of the ABB IRB 360-6/1600 delta robot and its use for time-optimal motion planning under consideration of constraint forces,,2024,Robotics and Autonomous Systems,Daniel Gnad; Hubert Gattringer; Andreas Müller; Wolfgang Höbarth; Roland Riepl; Lukas Meßner,10.1016/j.robot.2024.104823,,https://doi.org/10.1016/j.robot.2024.104823,crossref,task and motion planning robotics,anti_myopia,classic,,3,motion planning; task and motion planning,2026-06-12T15:07:36Z,19.693,23.693
doi:10.54254/2755-2721/2025.ast27134,Integrating Motion Planning in Vision Language Action Agents,"Vision-Language-Action (VLA) models integrate visual perception, natural language understanding, and embodied control into a unified framework, enabling end-to-end task execution from multimodal instructions. While such models have demonstrated impressive generalization across tasks and environments, their direct outputs—often in the form of discrete action tokens or waypoint sequences—frequently overlook key physical constraints, such as trajectory feasibility, collision avoidance, and dynamic consistency. This limitation hinders deployment in safety-critical and dynamic real-world settings. Integrating motion planning into VLA systems offers a principled solution, embedding geometric and dynamic constraints into the control pipeline to transform high-level semantic goals into safe, smooth, and executable trajectories. This work examines representative integration strategies alongside t",2025,Applied and Computational Engineering,Jianfeng Pang,10.54254/2755-2721/2025.ast27134,,https://doi.org/10.54254/2755-2721/2025.ast27134,crossref,vision language action model limitation robotics,hostile,failure,,,vision language action model; motion planning; limitation; generalization; deployment,2026-06-12T14:45:03Z,14.650,23.650
arxiv:2605.19209v1,Graph Neural Planning and Predictive Control for Multi-Robot Communication-Constrained Unlabeled Motion Planning,"The multi-robot unlabeled motion planning problem of concurrently assigning robots to goals and generating safe trajectories is central in many collaborative tasks. Recent Graph Neural Network methods offer scalable decentralized solutions but rely on simplified dynamics and simulation environments, overlooking key challenges of real-world deployment such as dynamic feasibility and communication constraints. To address these gaps, we propose a hierarchical framework that combines a Graph ATtention Planner (GATP) with a decentralized Nonlinear Model Predictive Controller (NMPC). GATP provides intermediate subgoals through multi-robot cooperation, and the NMPC enforces safety under nonlinear dynamics and actuation constraints. We evaluate our framework in both simulation and real-world quadrotor experiments. Thanks to attention mechanisms and minimal communication requirements, we demonstr",2026,arXiv,Manohari Goarin; Yang Zhou; Giuseppe Loianno,,2605.19209v1,http://arxiv.org/abs/2605.19209v1,arxiv,task and motion planning robotics,anti_myopia,classic,,,model predictive control; motion planning; task and motion planning; generalization; robustness; deployment,2026-06-12T15:07:36Z,14.450,23.450
arxiv:2406.16874v2,A Closed-Form Control for Safety Under Input Constraints Using a Composition of Control Barrier Functions,"We present a closed-form optimal control that satisfies both safety constraints (i.e., state constraints) and input constraints (e.g., actuator limits) using a composition of multiple control barrier functions (CBFs). This main contribution is obtained through the combination of several ideas. First, we present a method for constructing a single relaxed control barrier function (R-CBF) from multiple CBFs, which can have different relative degrees. The construction relies on a log-sum-exponential soft-minimum function and yields an R-CBF whose zero-superlevel set is a subset of the intersection of the zero-superlevel sets of all CBFs used in the composition. Next, we use the soft-minimum R-CBF to construct a closed-form control that is optimal with respect to a quadratic cost subject to the safety constraints. Finally, we use the soft-minimum R-CBF to develop a closed-form optimal control",2024,arXiv,Pedram Rabiee; Jesse B. Hoagg,,2406.16874v2,http://arxiv.org/abs/2406.16874v2,arxiv,control barrier functions robot learning,anti_myopia,control,,,safety constraint; control barrier function,2026-06-12T15:07:36Z,19.250,23.250
arxiv:2203.15107v1,Motion Planning for Agile Legged Locomotion using Failure Margin Constraints,"The complex dynamics of agile robotic legged locomotion requires motion planning to intelligently adjust footstep locations. Often, bipedal footstep and motion planning use mathematically simple models such as the linear inverted pendulum, instead of dynamically-rich models that do not have closed-form solutions. We propose a real-time optimization method to plan for dynamical models that do not have closed form solutions and experience irrecoverable failure. Our method uses a data-driven approximation of the step-to-step dynamics and of a failure margin function. This failure margin function is an oriented distance function in state-action space where it describes the signed distance to success or failure. The motion planning problem is formed as a nonlinear program with constraints that enforce the approximated forward dynamics and the validity of state-action pairs. For illustration, ",2022,arXiv,Kevin Green; John Warila; Ross L. Hatton; Jonathan Hurst,,2203.15107v1,http://arxiv.org/abs/2203.15107v1,arxiv,robot world model failure planning,hostile,failure,,,robot world model; motion planning; ablation; robot world model failure,2026-06-12T14:45:03Z,17.250,23.250
doi:10.1109/itsc60802.2025.11423203,A Real-Time Control Barrier Function-Based Safety Filter for Motion Planning with Arbitrary Road Boundary Constraints,,2025,2025 IEEE 28th International Conference on Intelligent Transportation Systems (ITSC),Jianye Xu; Chang Che; Bassam Alrifaee,10.1109/itsc60802.2025.11423203,,https://doi.org/10.1109/itsc60802.2025.11423203,crossref,sampling based motion planning,anti_myopia,anti_thesis,,,control barrier function; motion planning; sampling based motion planning,2026-06-12T15:07:36Z,19.200,23.200
doi:10.18280/mmep.090131,Motion Planning Solution with Constraints Based on Minimum Distance Model for Lane Change Problem of Autonomous Vehicles,"Lane change is one of the important operations in motion of an autonomous vehicle. When encountering obstacles or wanting to overtake the vehicle ahead, the autonomous vehicle will make a decision and choose the best path to control the trajectory of motion to perform lane change. In this article, we will present solutions for lane change trajectories, including general path setting, building nonlinear models with states of vehicle speed, acceleration and jerk; building a constraint set to avoid collisions with a minimum safe distance model, which takes into account the potentially collision angle positions during lane change. Simulation results are performed in Matlab simulation environment to demonstrate an effective proposed solution and addressed the disadvantages in the modeling process for lane-changing operations, in order to improve the proactive safety of the motion planning for",2022,Mathematical Modelling of Engineering Problems,Quach Hai Tho; Huynh Cong Phap; Pham Anh Phuong,10.18280/mmep.090131,,https://doi.org/10.18280/mmep.090131,crossref,sampling based motion planning,anti_myopia,anti_thesis,,2,motion planning; sampling based motion planning,2026-06-12T15:07:36Z,19.199,23.199
arxiv:2410.19656v1,APRICOT: Active Preference Learning and Constraint-Aware Task Planning with LLMs,"Home robots performing personalized tasks must adeptly balance user preferences with environmental affordances. We focus on organization tasks within constrained spaces, such as arranging items into a refrigerator, where preferences for placement collide with physical limitations. The robot must infer user preferences based on a small set of demonstrations, which is easier for users to provide than extensively defining all their requirements. While recent works use Large Language Models (LLMs) to learn preferences from user demonstrations, they encounter two fundamental challenges. First, there is inherent ambiguity in interpreting user actions, as multiple preferences can often explain a single observed behavior. Second, not all user preferences are practically feasible due to geometric constraints in the environment. To address these challenges, we introduce APRICOT, a novel approach t",2024,arXiv,Huaxiaoyue Wang; Nathaniel Chin; Gonzalo Gonzalez-Pumariega; Xiangwan Sun; Neha Sunkara; Maximus Adrian Pace; Jeannette Bohg; Sanjiban Choudhury,,2410.19656v1,http://arxiv.org/abs/2410.19656v1,arxiv,robot planning without learning,anti_myopia,anti_thesis,,,preference learning; limitation; robot planning without learning,2026-06-12T15:07:36Z,18.900,22.900
doi:10.1002/oca.70085,Solving for Blameless and Optimal Control Under Prioritized Safety Constraints,"ABSTRACT In many safety‐critical optimal control problems, users may request multiple safety constraints that are jointly infeasible due to external factors such as subsystem failures, unexpected disturbances, or fuel limitations. In this manuscript, we employ the concept of blameless optimality to characterize control actions that (a) satisfy the highest priority safety constraints that are feasible, and (b) remain optimal with respect to a mission objective. For a general optimal control problem with jointly infeasible safety constraints, we prove that there may not be a single optimization problem that solves for a blamelessly optimal controller. Instead, finding blamelessly optimal control actions requires sequentially solving at least two optimal control problems: one to determine the highest priority level of constraints that is feasible and another to determine the optimal control",2026,Optimal Control Applications and Methods,Natalia Pavlasek; Behçet Açıkmeşe; Meeko Oishi; Claus Danielson,10.1002/oca.70085,,https://doi.org/10.1002/oca.70085,crossref,optimal control robot manipulation,anti_myopia,anti_thesis,,,robot manipulation; safety constraint; limitation; optimal control robot manipulation,2026-06-12T15:07:36Z,16.900,22.900
doi:10.3390/buildings14082511,Utilizing Large Language Models to Illustrate Constraints for Construction Planning,"Effective construction project planning relies on addressing constraints related to materials, labor, equipment, and others. Planning meetings are typical venues for stakeholders to identify, communicate, and remove constraints. However, a critical gap exists in lacking an automated approach to identify, classify, analyze, and track constraint discussions during onsite planning meetings. Therefore, this research aims to 1. develop a natural language processing model to classify constraints in meeting discussions; 2. uncover the discussion patterns of managers and foremen regarding various constraints; and 3. extract the root causes for constraints, evaluate their impacts, and prepare managers to develop practical solutions for constraint removal. This research collected meeting transcripts from 94 onsite planning meetings of a building project, spanning 263,836 words. Next, this research",2024,Buildings,Chuanni He; Bei Yu; Min Liu; Lu Guo; Li Tian; Jianfeng Huang,10.3390/buildings14082511,,https://doi.org/10.3390/buildings14082511,crossref,large language model limitation robot planning,anti_myopia,anti_thesis,,29,limitation; large language model limitation robot planning,2026-06-12T15:07:36Z,18.751,22.751
arxiv:2409.19924v4,"On The Planning Abilities of OpenAI's o1 Models: Feasibility, Optimality, and Generalizability","Recent advancements in Large Language Models (LLMs) have showcased their ability to perform complex reasoning tasks, but their effectiveness in planning remains underexplored. In this study, we evaluate the planning capabilities of OpenAI's o1 models across a variety of benchmark tasks, focusing on three key aspects: feasibility, optimality, and generalizability. Through empirical evaluations on constraint-heavy tasks (e.g., $\textit{Barman}$, $\textit{Tyreworld}$) and spatially complex environments (e.g., $\textit{Termes}$, $\textit{Floortile}$), we highlight o1-preview's strengths in self-evaluation and constraint-following, while also identifying bottlenecks in decision-making and memory management, particularly in tasks requiring robust spatial reasoning. Our results reveal that o1-preview outperforms GPT-4 in adhering to task constraints and managing state transitions in structured ",2024,arXiv,Kevin Wang; Junbo Li; Neel P. Bhatt; Yihan Xi; Qiang Liu; Ufuk Topcu; Zhangyang Wang,,2409.19924v4,http://arxiv.org/abs/2409.19924v4,arxiv,robot world model failure planning,hostile,failure,,,robot world model; limitation; benchmark; generalization; robot world model failure,2026-06-12T14:45:03Z,14.650,22.650
doi:10.18196/jrc.v6i6.27770,Safe and Efficient Mobile Robot Navigation using Sampling-based Optimal Control with Barrier Function Constraints,"Safe and efficient navigation in constrained environments presents a significant challenge for omnidirectional Mecanum-wheeled mobile robots, especially when operating in dynamic or cluttered spaces. Many existing control approaches struggle to balance real-time performance with formal safety guarantees, creating a gap between theoretical models and practical implementation. To address this, we propose a hybrid Model Predictive Path Integral (MPPI) controller that incorporates Control Barrier Functions (CBFs) to enforce safety constraints during trajectory optimization. The research contribution is a unified framework that combines the flexibility of stochastic samplingbased planning with the rigor of formal safety enforcement, implemented using the GPU-accelerated JAX framework to enable fast, parallel trajectory evaluation at high control frequencies. Our method integrates CBFs through",2025,Journal of Robotics and Control (JRC),Nguyen Minh Duc Pham; Viet Anh Vu; Khai Nguyen; Quang Hiep Do; Minh Dong Nguyen; Manh Tien Ngo; Manh Duy Ngo,10.18196/jrc.v6i6.27770,,https://doi.org/10.18196/jrc.v6i6.27770,crossref,control barrier functions robot learning,anti_myopia,control,,1,safety constraint; control barrier function; model predictive control,2026-06-12T15:07:36Z,16.597,22.597
doi:10.1177/0278364914545811,Efficiently combining task and motion planning using geometric constraints,"We propose a constraint-based approach to address a class of problems encountered in combined task and motion planning (CTAMP), which we call kinematically constrained problems. CTAMP is a hybrid planning process in which task planning and geometric reasoning are interleaved. During this process, symbolic action sequences generated by a task planner are geometrically evaluated. This geometric evaluation is a search problem per se, which we refer to as geometric backtrack search. In kinematically constrained problems, a significant computational effort is spent on geometric backtrack search, which impairs search at the task level. At the basis of our approach to address this problem, is the introduction of an intermediate layer between task planning and geometric reasoning. A set of constraints is automatically generated from the symbolic action sequences to evaluate, and combined with a ",2014,The International Journal of Robotics Research,Fabien Lagriffoul; Dimitar Dimitrov; Julien Bidot; Alessandro Saffiotti; Lars Karlsson,10.1177/0278364914545811,,https://doi.org/10.1177/0278364914545811,crossref,task and motion planning robotics,anti_myopia,classic,,85,motion planning; task and motion planning,2026-06-12T15:07:36Z,17.477,22.477
doi:10.3390/drones8090493,Multi-Robot Path Planning Algorithm for Collaborative Mapping under Communication Constraints,"In extensive outdoor collaborative exploration tasks, multiple robots require efficient path planning methods to ensure rapid and comprehensive map construction. However, current collaborative mapping algorithms often integrate poorly with path planning, especially under limited communication conditions. Such conditions can complicate data exchange, leading to inefficiencies and missed areas in real-world environments. This paper introduces a path planning approach specifically designed for distributed collaborative mapping tasks, aimed at enhancing map completeness, mapping efficiency, and communication robustness under communication constraints. We frame the entire task as a k-Chinese Postman Problem (k-CPP) and optimize it using a genetic algorithm (GA). This method fully leverages topology maps to efficiently plan subpaths for multiple robots, ensuring thorough coverage of the mappin",2024,Drones,Chengyu Zhou; Junxiang Li; Meiping Shi; Tao Wu,10.3390/drones8090493,,https://doi.org/10.3390/drones8090493,crossref,robot world model failure planning,hostile,failure,,14,robot world model; robustness; robot world model failure,2026-06-12T15:07:36Z,16.454,22.454
doi:10.1146/annurev-control-060117-105226,Sampling-Based Methods for Motion Planning with Constraints,"Robots with many degrees of freedom (e.g., humanoid robots and mobile manipulators) have increasingly been employed to accomplish realistic tasks in domains such as disaster relief, spacecraft logistics, and home caretaking. Finding feasible motions for these robots autonomously is essential for their operation. Sampling-based motion planning algorithms are effective for these high-dimensional systems; however, incorporating task constraints (e.g., keeping a cup level or writing on a board) into the planning process introduces significant challenges. This survey describes the families of methods for sampling-based planning with constraints and places them on a spectrum delineated by their complexity. Constrained sampling-based methods are based on two core primitive operations: ( a) sampling constraint-satisfying configurations and ( b) generating constraint-satisfying continuous motion.",2018,"Annual Review of Control, Robotics, and Autonomous Systems",Zachary Kingston; Mark Moll; Lydia E. Kavraki,10.1146/annurev-control-060117-105226,,https://doi.org/10.1146/annurev-control-060117-105226,crossref,task and motion planning robotics,anti_myopia,classic,,168,humanoid robot; motion planning; task and motion planning; sampling based motion planning,2026-06-12T15:07:36Z,18.415,22.415
doi:10.58459/rptel.2026.21020,Causal discovery for automated real-world educational evidence extraction,"There is increasing demand to shift from intuition- and experience-based practices to evidence-based education. However, extracting meaningful evidence from real-world educational data poses significant challenges. Traditional approaches to evidence generation, such as randomized controlled trials and systematic reviews, face limitations in both the medical and educational domains due to high costs and ethical constraints. In response, the concept of real-world evidence has emerged as a promising alternative, particularly in medicine and, more recently, in education. Although this approach may be less robust than traditional methods, it offers the potential to uncover broad and practical insights from naturally occurring data. This study explores the use of deep learning for causal discovery in real-world educational data. Specifically, we apply Structural Agnostic Modeling, a method pre",2026,Research and Practice in Technology Enhanced Learning,Koki Okumura; Kento Nishioka; Kento Koike; Izumi Horikoshi; Hiroaki Ogata,10.58459/rptel.2026.21020,,https://doi.org/10.58459/rptel.2026.21020,crossref,causal robot world model,concept,architecture,,1,robot world model; causal robot world model; limitation,2026-06-12T15:07:36Z,19.347,22.347
