uid,title,abstract,year,venue,authors,doi,arxiv_id,url,source,query,query_role,family,advisor_seed,citation_count,matched_terms,retrieved_at,relevance_score,hostile_score
doi:10.1108/ir-01-2018-0004,Task constrained motion planning for 7-degree of freedom manipulators with parameterized submanifolds,"Purpose This paper aims to use the redundancy of a 7-DOF (degree of freedom) serial manipulator to solve motion planning problems along a given 6D Cartesian tool path, in the presence of geometric constraints, namely, obstacles and joint limits. Design/methodology/approach This paper describes an explicit expression of the task submanifolds for a 7-DOF redundant robot, and the submanifolds can be parameterized by two parameters with this explicit expression. Therefore, the global search method can find the feasible path on this parameterized graph. Findings The proposed planning algorithm is resolution complete and resolution optimal for 7-DOF manipulators, and the planned path can satisfy task constraint as well as avoiding singularity and collision. The experiments on Motoman SDA robot are reported to show the effectiveness. Research limitations/implications This algorithm is still tim",2018,Industrial Robot: An International Journal,Qiang Qiu; Qixin Cao,10.1108/ir-01-2018-0004,,https://doi.org/10.1108/ir-01-2018-0004,crossref,task and motion planning robotics,anti_myopia,classic,,7,motion planning; task and motion planning; limitation,2026-06-12T15:07:36Z,16.240,21.240
doi:10.1109/icra57147.2024.10611158,Parallel Optimization with Hard Safety Constraints for Cooperative Planning of Connected Autonomous Vehicles,,2024,2024 IEEE International Conference on Robotics and Automation (ICRA),Zhenmin Huang; Haichao Liu; Shaojie Shen; Jun Ma,10.1109/icra57147.2024.10611158,,https://doi.org/10.1109/icra57147.2024.10611158,crossref,robotics,concept,crossref_bulk_robotics,,4,safety constraint,2026-06-12T19:29:26Z,21.205,21.205
doi:10.3390/app12115369,Task-Oriented Motion Planning of a Space Manipulator under Multiple Constraints,"During task execution by a space manipulator, many factors need to be considered, such as joint motion range, external environment interference, running speed and task time. Studying the motion planning strategy under multi-constraint conditions is important for optimizing the task flow of the manipulator and improving the planning autonomy. Aiming at this, this paper proposes a method based on a hierarchical task network which has the ability to connect non-adjacent nodes of topology when generating the best path; it also carries out the control simulation of traditional path planning of a manipulator for typical tasks and the latter two working conditions using an optimal task planning method. The results show that this method is effective for realizing the Cartesian spatial task planning of a manipulator under multiple constraints and has important on-orbit application significance fo",2022,Applied Sciences,Changchun Liang; Dong Pan; Gang Chen; Pengfei Xin; Xiaodong Zhang,10.3390/app12115369,,https://doi.org/10.3390/app12115369,crossref,task and motion planning robotics,anti_myopia,classic,,2,motion planning; task and motion planning,2026-06-12T15:07:36Z,17.199,21.199
doi:10.1108/ir-11-2017-0200,Energy-optimal motion planning of a biped pole-climbing robot with kinodynamic constraints,"Purpose Applications of robotic systems in agriculture, forestry and high-altitude work will enter a new and huge stage in the near future. For these application fields, climbing robots have attracted much attention and have become one central topic in robotic research. The purpose of this paper is to propose an energy-optimal motion planning method for climbing robots that are applied in an outdoor environment. Design/methodology/approach First, a self-designed climbing robot named Climbot is briefly introduced. Then, an energy-optimal motion planning method is proposed for Climbot with simultaneous consideration of kinematic constraints and dynamic constraints. To decrease computing complexity, an acceleration continuous trajectory planner and a path planner based on spatial continuous curve are designed. Simulation and experimental results indicate that this method can search an energ",2018,Industrial Robot: An International Journal,Xuefeng Zhou; Li Jiang; Yisheng Guan; Haifei Zhu; Dan Huang; Taobo Cheng; Hong Zhang,10.1108/ir-11-2017-0200,,https://doi.org/10.1108/ir-11-2017-0200,crossref,robot world model failure planning,hostile,failure,,10,robot world model; motion planning; limitation; robot world model failure,2026-06-12T15:07:36Z,15.099,21.099
doi:10.3390/robotics15010023,Autonomous Mobile Robot Path Planning Techniques—A Review: Metaheuristic and Cognitive Techniques,"Autonomous mobile robots (AMRs) require robust, efficient path planning to operate safely in complex, often dynamic environments (e.g., logistics, transportation, and healthcare). This systematic review focuses on advanced metaheuristic and learning- and reasoning-based (cognitive) techniques for AMR path planning. Drawing on approximately 230 articles published between 2018 and 2025, we organize the literature into two prominent families, metaheuristic optimization and AI-based navigation, and introduce and apply a unified taxonomy (planning scope, output type, and constraint awareness) to guide the comparative analysis and practitioner-oriented synthesis. We synthesize representative approaches, including swarm- and evolutionary-based planners (e.g., PSO, GA, ACO, GWO), fuzzy and neuro-fuzzy systems, neural methods, and RL/DRL-based navigation, highlighting their operating principles, ",2026,Robotics,Mubarak Badamasi Aremu; Gamil Ahmed; Sami Elferik; Abdul-Wahid A. Saif,10.3390/robotics15010023,,https://doi.org/10.3390/robotics15010023,crossref,task and motion planning robotics,anti_myopia,classic,,10,sim to real transfer; motion planning; task and motion planning; limitation; benchmark; reproducibility; deployment,2026-06-12T15:07:36Z,13.099,21.099
doi:10.1115/1.4055625,Informed Sampling-Based Planning to Enable Legged Robots to Safely Negotiate Permeable Obstacles,"Abstract Legged robots have a unique capability of traversing rough terrains and negotiating cluttered environments. Recent control development of legged robots has enabled robust locomotion on rough terrains. However, such approaches mainly focus on maintaining balance for the robot body. In this work, we are interested in leveraging the whole body of the robot to pass through a permeable obstacle (e.g., a small confined opening) with height, width, and terrain constraints. This paper presents a planning framework for legged robots manipulating their body and legs to perform collision-free locomotion through a permeable obstacle. The planner incorporates quadrupedal gait constraint, biasing scheme, and safety margin for the simultaneous body and foothold motion planning. We perform informed sampling for the body poses and swing foot position based on the gait constraint while ensuring s",2023,Journal of Mechanisms and Robotics,Yiyu Chen; Lingchen Lian; Yu-Hsiu Hsieh; Quan Nguyen; Satyandra K. Gupta,10.1115/1.4055625,,https://doi.org/10.1115/1.4055625,crossref,sampling based motion planning,anti_myopia,anti_thesis,,5,motion planning; sampling based motion planning,2026-06-12T15:07:36Z,17.096,21.096
doi:10.1115/detc2021-72009,Task Space Planning With Complementarity Constraint-Based Obstacle Avoidance,"Abstract In this paper, we present a task space-based local motion planner that incorporates collision avoidance and constraints on end-effector motion during the execution of a task. Our key technical contribution is the development of a novel kinematic state evolution model of the robot where the collision avoidance is encoded as a complementarity constraint. We show that the kinematic state evolution with collision avoidance can be represented as a Linear Complementarity Problem (LCP). Using the LCP model along with Screw Linear Interpolation (ScLERP) in SE(3), we show that it may be possible to compute a path between two given task space poses by directly moving from the start to the goal pose, even if there are potential collisions with obstacles. Scalability of the planner is demonstrated with experiments using a physical robot. We present simulation and experimental results with b",2021,Volume 8B: 45th Mechanisms and Robotics Conference (MR),Anirban Sinha; Anik Sarker; Nilanjan Chakraborty,10.1115/detc2021-72009,,https://doi.org/10.1115/detc2021-72009,crossref,task and motion planning robotics,anti_myopia,classic,,6,motion planning; task and motion planning,2026-06-12T15:07:36Z,17.073,21.073
doi:10.1115/dscc2019-9237,On Receding Horizon Chance Constraint Motion Planning for Uncertain Multi-Agent Systems,Abstract We propose and study a motion planning algorithm for multi-agent autonomous systems to navigate through uncertain and dynamic environments. We use a receding horizon chance constraint framework that allows for tuning the trade-off between the risk of collision and the infeasibility of paths. We consider sampling-based incremental planning algorithms and extend them to the case of multiple agents and dynamic and uncertain environments. The receding horizon control framework is used to incorporate sensor measurements at a fixed interval of time to reduce uncertainty about agents’ state and environment. Our presentation focuses on rapidly-exploring random trees (RRTs) and the assumption of Gaussian noise in the uncertainty model. Our algorithm is illustrated using several examples.,2019,"Volume 3, Rapid Fire Interactive Presentations: Advances in Control Systems; Advances in Robotics and Mechatronics; Automotive and Transportation Systems; Motion Planning and Trajectory Tracking; Soft Mechatronic Actuators and Sensors; Unmanned Ground and Aerial Vehicles",Yash Bagla; Vaibhav Srivastava,10.1115/dscc2019-9237,,https://doi.org/10.1115/dscc2019-9237,crossref,task and motion planning robotics,anti_myopia,classic,,,motion planning; task and motion planning,2026-06-12T15:07:36Z,16.050,21.050
doi:10.3390/app16031500,Safety-Oriented Motion Planning for a Wheeled Humanoid Robot Operating in Environments with Stochastically Moving Humans,"With the advancement of humanoid robotics, human–robot collaboration has emerged as a prominent research focus. Ensuring the safety of both humanoid robots and humans remains a critical challenge. In this paper, we address conflict resolutions at the planning level and propose a safety-oriented motion planning (SOMP) algorithm for a wheeled humanoid robot operating in environments with unknown human motions. In the proposed SOMP algorithm, we employ Monte Carlo simulations to predict trajectories of stochastically moving humans and formulate both hard and soft constraints. A dynamic-quadrant stochastic sampling policy, integrated with a rapidly exploring random tree method, is proposed to generate diverse initial paths. Building upon this, we develop a constraint-fusion mechanism that combines hard constraints for safety guarantees and soft constraints for path optimization, thereby effe",2026,Applied Sciences,Jian Mi; Xianbo Zhang; Zhongjie Long; Jun Wang; Wei Xu,10.3390/app16031500,,https://doi.org/10.3390/app16031500,crossref,humanoid robot foundation model,concept,humanoid,,,robot foundation model; humanoid robot; motion planning; robustness,2026-06-12T15:07:36Z,19.000,21.000
doi:10.63808/ihf.v2i1.268,Human-Robot Collaborative Path Planning with Predictive Obstacle Avoidance,"Jointly planning paths for robots and humans in dynamic environments is considered an immensely complex task with regard to uncertainties in human motion patterns, thereby requiring real-time collision avoidance systems. Keeping in mind these challenges, there comes into existence in this publication an efficient, new model combining predictive systems for obstacle avoidance, along with hierarchical path planning to facilitate improved safety functions with optimized efficiency for collaborative robots. Utilizing the new model, there is the use of Gaussian Processes for Regression with biomechanical constraints to predict patterns in human motion with different predictive horizons in generating dynamic spatial risk maps for planning strategies for robot paths. A dual-level model, in particular, facilitates optimal trajectory planning for improved algorithms in RRT* algorithms, together w",2026,Intelligent & Human Futures,Song Huang,10.63808/ihf.v2i1.268,,https://doi.org/10.63808/ihf.v2i1.268,crossref,robot world model failure planning,hostile,failure,,,robot world model; latency; robot world model failure,2026-06-12T15:07:36Z,17.000,21.000
doi:10.1145/3719019,Improving Human Situational Awareness and Planning Using a Human-Centric Velocity-Obstacle Algorithm,"Human-robot teams in dynamic environments have the potential to leverage robot sensing and intelligence to augment human performance through motion suggestions. More specifically, we examine how humans can use external sensors (fixed or robotic) and a motion planning algorithm to help them navigate environments with dynamic obstacles. The novel human-centric velocity-obstacle (HCVO) algorithm suggests a feasible goal-oriented action while avoiding obstacles. Participants were placed in a custom virtual reality (VR) environment and tasked to follow a dynamic goal while avoiding collisions. We demonstrate, over N = 10 participants, that the HCVO algorithm’s guidance significantly improves safety compared to a base VO algorithm. We then examine the performance of N = 15 participants in three conditions: (1) no assistance/control, (2) a top-down drone-view of the entire environment, and 3) m",2025,ACM Transactions on Human-Robot Interaction,Aakash Bajpai; Alexander Lu; Kevin Choi; Rajan Tayal; Aaron Young; Anirban Mazumdar,10.1145/3719019,,https://doi.org/10.1145/3719019,crossref,robot world model failure planning,hostile,failure,,1,robot world model; motion planning; deployment; robot world model failure,2026-06-12T15:07:36Z,14.997,20.997
doi:10.3390/electronics7120395,Learning the Metric of Task Constraint Manifolds for Constrained Motion Planning,"Finding feasible motion for robots with high-dimensional configuration space is a fundamental problem in robotics. Sampling-based motion planning algorithms have been shown to be effective for these high-dimensional systems. However, robots are often subject to task constraints (e.g., keeping a glass of water upright, opening doors and coordinating operation with dual manipulators), which introduce significant challenges to sampling-based motion planners. In this work, we introduce a method to establish approximate model for constraint manifolds, and to compute an approximate metric for constraint manifolds. The manifold metric is combined with motion planning methods based on projection operations, which greatly improves the efficiency and success rate of motion planning tasks under constraints. The proposed method Approximate Graph-based Constrained Bi-direction Rapidly Exploring Tree ",2018,Electronics,Fusheng Zha; Yizhou Liu; Wei Guo; Pengfei Wang; Mantian Li; Xin Wang; Jingxuan Li,10.3390/electronics7120395,,https://doi.org/10.3390/electronics7120395,crossref,task and motion planning robotics,anti_myopia,classic,,8,motion planning; task and motion planning; sampling based motion planning,2026-06-12T15:07:36Z,16.949,20.949
doi:10.3390/app10249137,Sampling-Based Motion Planning for Free-Floating Space Robot without Inverse Kinematics,"Motion planning is one of the most important technologies for free-floating space robots (FFSRs) to increase operation safety and autonomy in orbit. As a nonholonomic system, a first-order differential relationship exists between the joint angle and the base attitude of the space robot, which makes it pretty challenging to implement the relevant motion planning. Meanwhile, the existing planning framework must solve inverse kinematics for goal configuration and has the limitation that the goal configuration and the initial configuration may not be in the same connected domain. Thus, faced with these questions, this paper investigates a novel motion planning algorithm based on rapidly-exploring random trees (RRTs) for an FFSR from an initial configuration to a goal end-effector (EE) pose. In a motion planning algorithm designed to deal with differential constraints and restrict base attitu",2020,Applied Sciences,Hongwen Zhang; Zhanxia Zhu,10.3390/app10249137,,https://doi.org/10.3390/app10249137,crossref,robot world model failure planning,hostile,failure,,12,robot world model; motion planning; limitation; sampling based motion planning; robot world model failure,2026-06-12T15:07:36Z,14.932,20.932
doi:10.2139/ssrn.6710262,Homotopy-Guided Parallel Planning with Dynamic Control Barrier Functions for Safety-Critical Navigation in Dynamic Environments,"Navigation in unstructured and dynamic environments requires a balance between global decision-making and rigorous safety guarantees. To this end, we propose a homotopy-guided parallel model predictive control framework with dynamic control barrier functions. The framework employs a spatiotemporal graph search to guide a parallelized model predictive control scheme, where relaxed linear hyperplanes provide soft topological guidance and discrete-time dynamic control barrier functions enforce safety constraints and promote forward invariance whenever feasibility is maintained. By decoupling topological guidance from safety constraints, the proposed method mitigates solver infeasibility during tight maneuvers while better exploiting nonconvex free space. Simulations in high-density environments show that the method achieves higher success rate with minimal deadlocks, demonstrating its effec",,,Tao Zhang; Yi Dong; Guangdeng Zong,10.2139/ssrn.6710262,,https://doi.org/10.2139/ssrn.6710262,crossref,control barrier functions robot learning,anti_myopia,control,,,safety constraint; control barrier function; model predictive control,2026-06-12T15:07:36Z,16.900,20.900
doi:10.3390/act15020116,Risk-Aware Adaptive Safety Margins for Model Predictive Control with Orientation–Motion Coupled Barrier Functions in Dynamic Environments,"Safe navigation in dynamic environments remains challenging because classical distance-based constraints ignore the coupling between a robot’s translational motion and attitude dynamics, and fixed safety margins are either over-conservative or risky under varying uncertainty and approach speed. This paper presents a Risk-Aware Model Predictive Control (RA-MPC) framework that addresses both limitations through two integrated components. First, we introduce Orientation–Motion Coupled Control Barrier Functions (O-MCBFs) that enforce unified safety constraints linking collision avoidance with attitude stability limits, preventing dangerous pose configurations during dynamic obstacle avoidance. Second, we develop Risk-Aware Adaptive Margins (RAAMs) that compute time-varying safety buffers based on relative velocity, robot braking capability, and prediction uncertainty, enabling context-depend",2026,Actuators,Nuo Xu; Zhong Yang; Haoze Zhuo; Lvwei Liao; Yaoyu Sui; Naifeng He,10.3390/act15020116,,https://doi.org/10.3390/act15020116,crossref,control barrier functions robot learning,anti_myopia,control,,,safety constraint; control barrier function; model predictive control; limitation,2026-06-12T15:07:36Z,13.900,20.900
doi:10.1007/s41315-019-00109-z,A bilevel optimal motion planning (BOMP) model with application to autonomous parking,"Abstract In this paper, we present a bilevel optimal motion planning (BOMP) model for autonomous parking. The BOMP model treats motion planning as an optimal control problem, in which the upper level is designed for vehicle nonlinear dynamics, and the lower level is for geometry collision-free constraints. The significant feature of the BOMP model is that the lower level is a linear programming problem that serves as a constraint for the upper-level problem. That is, an optimal control problem contains an embedded optimization problem as constraints. Traditional optimal control methods cannot solve the BOMP problem directly. Therefore, the modified approximate Karush–Kuhn–Tucker theory is applied to generate a general nonlinear optimal control problem. Then the pseudospectral optimal control method solves the converted problem. Particularly, the lower level is the $$J_2$$ J 2 -function t",2019,International Journal of Intelligent Robotics and Applications,Shenglei Shi; Youlun Xiong; Jiankui Chen; Caihua Xiong,10.1007/s41315-019-00109-z,,https://doi.org/10.1007/s41315-019-00109-z,crossref,robot world model failure planning,hostile,failure,,17,robot world model; motion planning; robot world model failure,2026-06-12T15:07:36Z,14.895,20.895
doi:10.3390/s25061900,Redundancy-Based Motion Planning with Task Constraints for Robot Manipulators,"Finding realistic motions for redundant manipulators is essential for complex jobs such as home care and industrial assembly. Motion planning is complex when a task requires standing upright or moving through restricted spaces. This work provides an effective motion-planning strategy for 7-DOF manipulators that improves connections via redundancy. The analytic Cartesian-space-to-joint-space kinematic mapping models for 7-DOF redundant manipulators with diverse configurations are constructed first, and the feasible nodes are determined by sampling the Cartesian space without barriers to satisfy the task requirements. Each Cartesian-space sampling node can provide numerous feasible joint-space nodes because of the redundancy of the robot manipulators. To remove additional valid nodes from a singular position, joint configurations with the same end-effector position orientation are modified",2025,Sensors,Yi Zhang; Hongguang Wang,10.3390/s25061900,,https://doi.org/10.3390/s25061900,crossref,robot world model failure planning,hostile,failure,,5,robot world model; motion planning; robot world model failure,2026-06-12T15:07:36Z,15.846,20.846
doi:10.1177/0278364918761570,An incremental constraint-based framework for task and motion planning,"We present a new constraint-based framework for task and motion planning (TMP). Our approach is extensible, probabilistically complete, and offers improved performance and generality compared with a similar, state-of-the-art planner. The key idea is to leverage incremental constraint solving to efficiently incorporate geometric information at the task level. Using motion feasibility information to guide task planning improves scalability of the overall planner. Our key abstractions address the requirements of manipulation and object rearrangement. We validate our approach on a physical manipulator and evaluate scalability on scenarios with many objects and long plans, showing order-of-magnitude gains compared with the benchmark planner and improved scalability from additional geometric guidance. Finally, in addition to describing a new method for TMP and its implementation on a physical ",2018,The International Journal of Robotics Research,Neil T Dantam; Zachary K Kingston; Swarat Chaudhuri; Lydia E Kavraki,10.1177/0278364918761570,,https://doi.org/10.1177/0278364918761570,crossref,task and motion planning robotics,anti_myopia,classic,,104,motion planning; task and motion planning; benchmark,2026-06-12T15:07:36Z,15.827,20.827
arxiv:2602.20102v2,BarrierSteer: LLM Safety via Learning Barrier Steering,"Despite the strong performance of large language models (LLMs) across diverse tasks, their susceptibility to adversarial attacks and unsafe content generation remains a significant obstacle to deployment, particularly in high-stakes settings. Addressing this challenge requires safety mechanisms that are both practically effective and theoretically grounded. In this paper, we introduce BarrierSteer, a novel inference-time framework that improves response safety by embedding learned nonlinear safety constraints directly into the model's latent representation space. BarrierSteer treats hidden-state safety classifiers as Control Barrier Functions (CBFs), enabling constraint-guided steering of unsafe latent trajectories during generation. By composing multiple safety constraints through efficient constraint merging without modifying the underlying LLM parameters, BarrierSteer preserves model ",2026,arXiv,Thanh Q. Tran; Arun Verma; Kiwan Wong; Bryan Kian Hsiang Low; Daniela Rus; Wei Xiao,,2602.20102v2,http://arxiv.org/abs/2602.20102v2,arxiv,control barrier functions robot learning,anti_myopia,control,,,safety constraint; control barrier function; deployment,2026-06-12T15:07:36Z,16.800,20.800
