uid,title,abstract,year,venue,authors,doi,arxiv_id,url,source,query,query_role,family,advisor_seed,citation_count,matched_terms,retrieved_at,relevance_score,hostile_score
doi:10.1108/ir-10-2023-0251,An efficient constraint method for solving planning problems under end-effector constraints,"Purpose In response to the challenge of reduced efficiency or failure of robot motion planning algorithms when faced with end-effector constraints, this study aims to propose a new constraint method to improve the performance of the sampling-based planner. Design/methodology/approach In this work, a constraint method (TC method) based on the idea of cross-sampling is proposed. This method uses the tangent space in the workspace to approximate the constrained manifold pattern and projects the entire sampling process into the workspace for constraint correction. This method avoids the need for extensive computational work involving multiple iterations of the Jacobi inverse matrix in the configuration space and retains the sampling properties of the sampling-based algorithm. Findings Simulation results demonstrate that the performance of the planner when using the TC method under the end-ef",2024,Industrial Robot: the international journal of robotics research and application,Yahao Wang; Zhen Li; Yanghong Li; Erbao Dong,10.1108/ir-10-2023-0251,,https://doi.org/10.1108/ir-10-2023-0251,crossref,EBM transformer robotics industrial robot,concept,architecture_x_embodiment,,3,EBM transformer robotics; industrial robot; motion planning,2026-06-12T15:07:36Z,20.143,22.143
arxiv:2106.07127v1,Transition Motion Planning for Multi-Limbed Vertical Climbing Robots Using Complementarity Constraints,"In order to achieve autonomous vertical wall climbing, the transition phase from the ground to the wall requires extra consideration inevitably. This paper focuses on the contact sequence planner to transition between flat terrain and vertical surfaces for multi-limbed climbing robots. To overcome the transition phase, it requires planning both multi-contact and contact wrenches simultaneously which makes it difficult. Instead of using a predetermined contact sequence, we consider various motions on different environment setups via modeling contact constraints and limb switchability as complementarity conditions. Two safety factors for toe sliding and motor over-torque are the main tuning parameters for different contact sequences. By solving as a nonlinear program (NLP), we can generate several feasible sequences of foot placements and contact forces to avoid failure cases. We verified ",2021,arXiv,Jingwen Zhang; Xuan Lin; Dennis W Hong,,2106.07127v1,http://arxiv.org/abs/2106.07127v1,arxiv,robot world model failure planning,hostile,failure,,,robot world model; motion planning; robot world model failure,2026-06-12T14:45:03Z,17.050,22.050
doi:10.1115/dscc2018-9006,Barrier Lyapunov Function Based Control of a Flexible Link Co-Robot With Safety Constraints,"In this paper, a control design for a flexible link co-robot with safety constraints is proposed. The safety constraints are converted to the constraints on the tip position and velocity. To handle this constrained control problem, a barrier Lyapunov function (BLF) is employed in the control design. The derivative of the logarithmic BLF is more complicated compared with the derivative of a quadratic Lyapunov function, which makes the problem of “explosion of terms” more serious. Thus, the dynamic surface control is used to deal with the problem. Furthermore, an extended state observer is adopted to estimate and compensate the uncertainty and disturbance in the system. The stability analysis via the singular perturbation theory shows the local practical exponential stability of the system. Simulation results indicate that the control performance is guaranteed without violation of the cons",2018,"Volume 3: Modeling and Validation; Multi-Agent and Networked Systems; Path Planning and Motion Control; Tracking Control Systems; Unmanned Aerial Vehicles (UAVs) and Application; Unmanned Ground and Aerial Vehicles; Vibration in Mechanical Systems; Vibrations and Control of Systems; Vibrations: Modeling, Analysis, and Control",Siyang Song; Yu She; Junmin Wang; Haijun Su,10.1115/dscc2018-9006,,https://doi.org/10.1115/dscc2018-9006,crossref,control barrier functions robot learning,anti_myopia,control,,2,safety constraint; control barrier function,2026-06-12T15:07:36Z,18.049,22.049
doi:10.24963/ijcai.2019/68,Multi-Robot Planning Under Uncertain Travel Times and Safety Constraints,"We present a novel modelling and planning approach for multi-robot systems under uncertain travel times. The approach uses generalised stochastic Petri nets (GSPNs) to model desired team behaviour, and allows to specify safety constraints and rewards. The GSPN is interpreted as a Markov decision process (MDP) for which we can generate policies that optimise the requirements. This representation is more compact than the equivalent multi-agent MDP, allowing us to scale better. Furthermore, it naturally allows for asynchronous execution of the generated policies across the robots, yielding smoother team behaviour. We also describe how the integration of the GSPN with a lower-level team controller allows for accurate expectations on team performance. We evaluate our approach on an industrial scenario, showing that it outperforms hand-crafted policies used in current practice.",2019,,Masoumeh Mansouri; Bruno Lacerda; Nick Hawes; Federico Pecora,10.24963/ijcai.2019/68,,https://doi.org/10.24963/ijcai.2019/68,openalex,robotics,concept,openalex_bulk_robotics,,17,multi robot system; safety constraint,2026-06-12T18:57:17Z,21.945,21.945
arxiv:2606.09027v1,SafeRun: Enabling Determinism in LLM Planning for Running,"Large Language Models enable flexible natural-language planning but remain unreliable in determinism-critical domains due to their probabilistic nature. This limitation is especially problematic in running planning, where violating safety rules can lead to safety risks. We propose SafeRun, a framework for deterministic LLM-based planning via a decoupled architecture. SafeRun separates soft interpretation by an LLM from hard constraint enforcement by a deterministic solver, ensuring strict safety constraints while preserving natural-language flexibility. To validate SafeRun, we build a comprehensive benchmark for running planning under realistic physiological and safety constraints. Experiments across five LLMs show that SafeRun achieves 100\% safety score (vs.\ 79.1\% PE average and 97.6\% CodeAct average) while maintaining competitive instruction-following scores. The SafeRun benchmark ",2026,arXiv,Meilin Chen; Zepeng Zhai; Jiaxuan Zhao; Yuan Lu,,2606.09027v1,http://arxiv.org/abs/2606.09027v1,arxiv,large language model limitation robot planning,anti_myopia,anti_thesis,,,safety constraint; limitation; benchmark; large language model limitation robot planning,2026-06-12T15:07:36Z,16.800,21.800
doi:10.1177/02783649221120029,"Constraint-consistent task-oriented whole-body robot formulation: Task, posture, constraints, multiple contacts, and balance","We present a comprehensive formulation to the problem of controlling a high-dimensional robotic system involving complex tasks subject to a variety of constraints, obstacles, balance, and contact challenges. Using intuitive and natural representations, the approach is initiated by establishing individual objectives for a task and its constraints. Simple independent controllers using artificial potential fields are then designed for each objective to reach goals while enforcing the constraints. Dynamically consistent projections in nullspaces associated with task and constraint representations are employed to deliver a coherent whole-body robot control. In multi-link multi-contact tasks, contact forces produce both resulting and internal forces. Internal forces play a critical role in robot balance and stability, achieved in this framework through modeling and controlling virtual linkages",2022,The International Journal of Robotics Research,Oussama Khatib; Mikael Jorda; Jaeheung Park; Luis Sentis; Shu-Yun Chung,10.1177/02783649221120029,,https://doi.org/10.1177/02783649221120029,crossref,task and motion planning robotics,anti_myopia,classic,,18,force control; motion planning; task and motion planning; underactuation,2026-06-12T15:07:36Z,17.772,21.772
doi:10.1109/lra.2021.3067847,"MPC-MPNet: Model-Predictive Motion Planning Networks for Fast, Near-Optimal Planning Under Kinodynamic Constraints",,2021,IEEE Robotics and Automation Letters,Linjun Li; Yinglong Miao; Ahmed H. Qureshi; Michael C. Yip,10.1109/lra.2021.3067847,,https://doi.org/10.1109/lra.2021.3067847,crossref,robot world model failure planning,hostile,failure,,50,robot world model; motion planning; robot world model failure,2026-06-12T14:45:03Z,15.766,21.766
doi:10.1155/2018/6060924,Urban Motion Planning Framework Based on N-Bézier Curves Considering Comfort and Safety,"In last decades, great technology advances have been done related to the automotive sector, especially in Advanced Driver Assistance Systems (ADAS) developed to improve mobility in terms of comfort and safety during driving process; hence, automated driving is presented as an evolution of those systems in the present and upcoming years. The aim of this work is to present a complete framework of motion planning for automated vehicles, considering different constraints with parametric curves for lateral and longitudinal planners. Parametric Bézier curves are used as the core approach for trajectory design in intersections, roundabouts, and lane change maneuvers. Additionally, a speed planner algorithm is presented using the same parametric curve approach, considering comfort and safety. A simulation environment is used for testing the planning method in urban conditions. Finally, tests wit",2018,Journal of Advanced Transportation,Ray Lattarulo; Leonardo González; Enrique Martí; José Matute; Mauricio Marcano; Joshue Pérez,10.1155/2018/6060924,,https://doi.org/10.1155/2018/6060924,crossref,sampling based motion planning,anti_myopia,anti_thesis,,43,motion planning; sampling based motion planning,2026-06-12T15:07:36Z,17.742,21.742
doi:10.1007/s10846-026-02403-y,STL-Based Motion Planning and Uncertainty-Aware Risk Analysis for Human-Robot Collaboration with a Multi-Rotor Aerial Vehicle,"Abstract This paper presents a motion planning and risk analysis framework for enhancing human-robot collaboration with a Multi-Rotor Aerial Vehicle. The proposed method employs Signal Temporal Logic to encode key mission objectives, including safety, temporal requirements, and human preferences, with particular emphasis on ergonomics and comfort. An optimization-based planner generates dynamically feasible trajectories while explicitly accounting for the vehicle’s nonlinear dynamics and actuation constraints. To address the resulting non-convex and non-smooth optimization problem, smooth robustness approximations and gradient-based techniques are adopted. In addition, an uncertainty-aware risk analysis is introduced to quantify the likelihood of specification violations under human-pose uncertainty. A robustness-aware event-triggered replanning strategy further enables online recovery f",2026,Journal of Intelligent & Robotic Systems,Giuseppe Silano; Amr Afifi; Martin Saska; Antonio Franchi,10.1007/s10846-026-02403-y,,https://doi.org/10.1007/s10846-026-02403-y,crossref,robot world model failure planning,hostile,failure,,,robot world model; motion planning; robustness; robot world model failure,2026-06-12T15:07:36Z,14.650,21.650
doi:10.1088/2631-8695/ae4b0c,An enhanced beluga whale optimization algorithm incorporating cauchy mutation based on swarm-elite learning mechanism and quadratic interpolation strategy for mobile robot path planning,"Abstract Mobile robot path planning is a critical prerequisite for ensuring safe, efficient, and stable operations in fields like smart logistics, industrial automation, and service robotics—poor path quality directly compromises task success rates and equipment safety. However, the conventional Beluga Whale Optimization (BWO) algorithm, when applied to this task, suffers from inherent limitations: susceptibility to local optima due to insufficient global exploration, sluggish convergence in later iterations, and inadequate population diversity after the whale fall phase. To address these challenges, this paper first constructs a comprehensive cost function integrating path length minimization, obstacle collision avoidance, and maximum turning angle constraints, effectively transforming the complex 2D mobile robot path planning problem into a multi-constraint optimization problem. Subseq",2026,Engineering Research Express,Yongbo Wang,10.1088/2631-8695/ae4b0c,,https://doi.org/10.1088/2631-8695/ae4b0c,crossref,robot planning without learning,anti_myopia,anti_thesis,,,limitation; benchmark; robot planning without learning,2026-06-12T15:07:36Z,16.600,21.600
doi:10.3390/s25216741,DPDQN-TER: An Improved Deep Reinforcement Learning Approach for Mobile Robot Path Planning in Dynamic Scenarios,"Efficient and stable path planning in dynamic and obstacle-dense environments, such as large-scale structure assembly measurement, is essential for improving the practicality and environmental adaptability of mobile robots in measurement and quality inspection tasks. However, traditional reinforcement learning methods often suffer from inefficient use of experience and limited capability to represent policy structures in complex dynamic scenarios. To overcome these limitations, this study proposes a method named DPDQN-TER that integrates Transformer-based sequence modeling with a multi-branch parameter policy network. The proposed method introduces a temporal-aware experience replay mechanism that employs multi-head self-attention to capture causal dependencies within state transition sequences. By dynamically weighting and sampling critical obstacle-avoidance experiences, this mechanism",2025,Sensors,Shuyuan Gao; Yang Xu; Xiaoxiao Guo; Chenchen Liu; Xiaobai Wang,10.3390/s25216741,,https://doi.org/10.3390/s25216741,crossref,robot planning without learning,anti_myopia,anti_thesis,,3,limitation; benchmark; generalization; ablation; deployment; robot planning without learning,2026-06-12T15:07:36Z,12.593,21.593
doi:10.1016/j.conengprac.2024.106155,Nonlinear model predictive control with set terminal constraint for safe robot motion planning via speed and separation monitoring,,2025,Control Engineering Practice,Aigerim Nurbayeva; Matteo Rubagotti,10.1016/j.conengprac.2024.106155,,https://doi.org/10.1016/j.conengprac.2024.106155,crossref,robot world model failure planning,hostile,failure,,6,robot world model; model predictive control; motion planning; robot world model failure,2026-06-12T14:45:03Z,15.573,21.573
doi:10.1177/1729881419836858,Inverse kinematics-based motion planning for dual-arm robot with orientation constraints,"This article proposes an efficient and probabilistic complete planning algorithm to address motion planning problem involving orientation constraints for decoupled dual-arm robots. The algorithm is to combine sampling-based planning method with analytical inverse kinematic calculation, which randomly samples constraint-satisfying configurations on the constraint manifold using the analytical inverse kinematic solver and incrementally connects them to the motion paths in joint space. As the analytical inverse kinematic solver is applied to calculate constraint-satisfying joint configurations, the proposed algorithm is characterized by its efficiency and accuracy. We have demonstrated the effectiveness of our approach on the Willow Garage’s PR2 simulation platform by generating trajectory across a wide range of orientation-constrained scenarios for dual-arm manipulation.",2019,International Journal of Advanced Robotic Systems,Jiangping Wang; Shirong Liu; Botao Zhang; Changbin Yu,10.1177/1729881419836858,,https://doi.org/10.1177/1729881419836858,crossref,sampling based motion planning,anti_myopia,anti_thesis,,17,motion planning; sampling based motion planning,2026-06-12T15:07:36Z,17.495,21.495
doi:10.1049/csy2.70004,Enhancing stability and safety: A novel multi‐constraint model predictive control approach for forklift trajectory,"Abstract The advancements in intelligent manufacturing have made high‐precision trajectory tracking technology crucial for improving the efficiency and safety of in‐factory cargo transportation. This study addresses the limitations of current forklift navigation systems in trajectory control accuracy and stability by proposing the Enhanced Stability and Safety Model Predictive Control (ESS‐MPC) method. This approach includes a multi‐constraint strategy for improved stability and safety. The kinematic model for a single front steering‐wheel forklift vehicle is constructed with all known state quantities, including the steering angle, resulting in a more accurate model description and trajectory prediction. To ensure vehicle safety, the spatial safety boundary obtained from the trajectory planning module is established as a hard constraint for ESS‐MPC tracking. The optimisation constraints",2024,IET Cyber-Systems and Robotics,Yizhen Sun; Junyou Yang; Donghui Zhao; Moses Chukwuka Okonkwo; Jianmin Zhang; Shuoyu Wang; Yang Liu,10.1049/csy2.70004,,https://doi.org/10.1049/csy2.70004,crossref,robotics,concept,crossref_bulk_robotics,,3,model predictive control; limitation,2026-06-12T19:29:26Z,19.493,21.493
doi:10.48550/arxiv.2103.14252,Toward Safety-Aware Informative Motion Planning for Legged Robots,"This paper reports on developing an integrated framework for safety-aware informative motion planning suitable for legged robots. The information-gathering planner takes a dense stochastic map of the environment into account, while safety constraints are enforced via Control Barrier Functions (CBFs). The planner is based on the Incrementally-exploring Information Gathering (IIG) algorithm and allows closed-loop kinodynamic node expansion using a Model Predictive Control (MPC) formalism. Robotic exploration and information gathering problems are inherently path-dependent problems. That is, the information collected along a path depends on the state and observation history. As such, motion planning solely based on a modular cost does not lead to suitable plans for exploration. We propose SAFE-IIG, an integrated informative motion planning algorithm that takes into account: 1) a robot's per",2021,arXiv (Cornell University),Sangli Teng; Yukai Gong; Jessy W. Grizzle; Maani Ghaffari,10.48550/arxiv.2103.14252,,https://doi.org/10.48550/arxiv.2103.14252,openalex,robotics,concept,openalex_bulk_robotics,,22,safety constraint; control barrier function; model predictive control; motion planning,2026-06-12T18:57:17Z,19.468,21.468
arxiv:2509.24143v2,A Novel Model for 3D Motion Planning for a Generalized Dubins Vehicle with Pitch and Yaw Rate Constraints,"In this paper, we propose a new modeling approach and a fast algorithm for 3D motion planning, applicable for fixed-wing unmanned aerial vehicles. The goal is to construct the shortest path connecting given initial and final configurations subject to motion constraints. Our work differs from existing literature in two ways. First, we consider full vehicle orientation using a body-attached frame, which includes roll, pitch, and yaw angles. However, existing work uses only pitch and/or heading angle, which is insufficient to uniquely determine orientation. Second, we use two control inputs to represent bounded pitch and yaw rates, reflecting control by two separate actuators. In contrast, most previous methods rely on a single input, such as path curvature, which is insufficient for accurately modeling the vehicle's kinematics in 3D. We use a rotation minimizing frame to describe the vehic",2025,arXiv,Deepak Prakash Kumar; Swaroop Darbha; Satyanarayana Gupta Manyam; David W. Casbeer,,2509.24143v2,http://arxiv.org/abs/2509.24143v2,arxiv,sampling based motion planning,anti_myopia,anti_thesis,,,motion planning; sampling based motion planning,2026-06-12T15:07:36Z,17.450,21.450
arxiv:2603.03514v1,Sampling-Based Motion Planning with Scene Graphs Under Perception Constraints,"It will be increasingly common for robots to operate in cluttered human-centered environments such as homes, workplaces, and hospitals, where the robot is often tasked to maintain perception constraints, such as monitoring people or multiple objects, for safety and reliability while executing its task. However, existing perception-aware approaches typically focus on low-degree-of-freedom (DoF) systems or only consider a single object in the context of high-DoF robots. This motivates us to consider the problem of perception-aware motion planning for high-DoF robots that accounts for multi-object monitoring constraints. We employ a scene graph representation of the environment, offering a great potential for incorporating long-horizon task and motion planning thanks to its rich semantic and spatial information. However, it does not capture perception-constrained information, such as the vi",2026,arXiv,Qingxi Meng; Emiliano Flores; Thai Duong; Vaibhav Unhelkar; Lydia E. Kavraki,,2603.03514v1,http://arxiv.org/abs/2603.03514v1,arxiv,sampling based motion planning,anti_myopia,anti_thesis,,,motion planning; task and motion planning; long horizon; sampling based motion planning,2026-06-12T15:07:36Z,17.450,21.450
doi:10.2196/87367,"Shoggoths, Sycophancy, Psychosis, Oh My: Rethinking Large Language Model Use and Safety",,2025,Journal of Medical Internet Research,Kayleigh-Ann Clegg,10.2196/87367,,https://doi.org/10.2196/87367,crossref,large language model limitation robot planning,anti_myopia,anti_thesis,,11,limitation; large language model limitation robot planning,2026-06-12T15:07:36Z,17.442,21.442
doi:10.1016/j.robot.2025.105109,Coverage Trajectory Planning Problem on 3D Terrains with safety constraints for automated lawn mower: Exact and heuristic approaches,,2025,Robotics and Autonomous Systems,Hang Zhou; Peng Zhang; Zhaohui Liang; Hangyu Li; Xiaopeng Li,10.1016/j.robot.2025.105109,,https://doi.org/10.1016/j.robot.2025.105109,crossref,robotics,concept,crossref_bulk_robotics,,4,safety constraint,2026-06-12T19:29:26Z,21.405,21.405
doi:10.3390/app11198879,Joint Motion Planning of Industrial Robot Based on Modified Cubic Hermite Interpolation with Velocity Constraint,"As for industrial robots’ point-to-point joint motion planning with constrained velocity, cubic polynomial planning has the problem of discontinuous acceleration; quintic polynomial planning requires acceleration to be specified in advance, which will likely cause velocity to fluctuate largely because appropriate acceleration assigned in advance is hardly acquired. Aiming at these problems, a modified cubic Hermite interpolation for joint motion planning was proposed. In the proposed methodology, knots of cubic Hermite interpolation need to be reconfigured according to the initial knots. The formulas for how to build new knots were put forward after derivation. Using the newly-built knots instead of initial knots for cubic Hermite interpolation, joint motion planning was carried out. The purpose was that the joint planning not only satisfied the displacement and velocity constraints at t",2021,Applied Sciences,Yasong Pu; Yaoyao Shi; Xiaojun Lin; Wenbin Zhang; Pan Zhao,10.3390/app11198879,,https://doi.org/10.3390/app11198879,crossref,sampling based motion planning,anti_myopia,anti_thesis,,11,industrial robot; motion planning; sampling based motion planning,2026-06-12T15:07:36Z,17.342,21.342
doi:10.1109/icar.2015.7251458,Model predictive path planning with time-varying safety constraints for highway autonomous driving,,2015,2015 International Conference on Advanced Robotics (ICAR),Mehdi Jalalmaab; Baris Fidan; Soo Jeon; Paolo Falcone,10.1109/icar.2015.7251458,,https://doi.org/10.1109/icar.2015.7251458,crossref,robotics,concept,crossref_bulk_robotics,,27,safety constraint,2026-06-12T19:29:26Z,20.266,21.266
doi:10.31763/ijrcs.v5i4.2004,A Survey of RRT* Variants and Enhancements for Robotic Path Planning,"Sampling-based planners like Rapidly?exploring Random Trees Star (RRT*) have proven powerful for robotic path planning. However, practical deployments expose limitations in convergence speed, dynamic feasibility, collision?checking overhead, and adaptability to changing environments. This paper introduces a novel practice-oriented taxonomy and decision map that aligns RRT* variants with constraints (dynamic, kinodynamic, and safety) and computes budgets. First, we review guided sampling techniques, including Informed RRT*, bridge?test sampling, and region?biased strategies that focus computational effort on promising regions, accelerating convergence. Next, we examine kinodynamic extensions such as Kinodynamic RRT* and LQR?RRT*, which embed system dynamics and optimal?control heuristics directly into the tree growth, yielding smooth, dynamically?feasible trajectories for under actuated m",2025,International Journal of Robotics and Control Systems,Hameed Salman Hameed; Firas Abdulrazzaq Raheem; Omar Farouq Lutfy,10.31763/ijrcs.v5i4.2004,,https://doi.org/10.31763/ijrcs.v5i4.2004,crossref,classical control robotics,anti_myopia,anti_thesis,,,limitation; deployment; classical control robotics,2026-06-12T15:07:36Z,14.250,21.250
